Cu In O Sb,0.6278579382333331
Ag C H O,0.6278344494666666
B Dy Fe Th,0.6278237967333339
Mg Na O W,0.6278237422466668
Mn Si V Zr,0.6278009334000001
As C H Si,0.6277750445666667
Al Fe Lu Ti,0.6277506296333333
K Mg O Ti,0.6277495218666669
Al O Te V,0.6277462459666668
Mg O Sc Si,0.6276492202000004
H Li Mo O,0.6275759021499997
Br H Mo O,0.6275270943333333
Ca Eu O V,0.6273445520199997
Fe Ge Ho Sn,0.627223645766667
B F N S,0.6271403308033332
Ca Lu O V,0.627134187553334
Eu Ir Mg O,0.6270127251666667
Fe Ni Pd S,0.6269411524333336
H K O V,0.626902104
Ba O Te V,0.6268681989499996
Ca Cr Nb O,0.6268545848999999
B Fe Gd Si,0.6268171532666666
Fe Ge Sn Tb,0.6267692343666675
Ba Bi Ca O,0.6267333431333336
Cl K Nb Y,0.6265534392366673
Ba K Mn O,0.6264720529
Li Mo Nd O,0.6264373557333331
N O W Yb,0.6264217776
Ba Er Nb O,0.626366483473333
Ca Er Nb O,0.6261741882899999
O Si V Zr,0.6261381378199996
Ca Ho O V,0.626093400633333
N O Pt S,0.6260877239533335
La N O S,0.6259567819499999
C H O Sm,0.6259265366999999
C S Ta V,0.625684682866666
B Fe Ni P,0.6256844165333326
F N O U,0.6256561790466661
Mn Na O V,0.6256252754
C Mn Sn Zn,0.6255931394333334
C Cl Li W,0.6255683563999999
Li Mo O Rb,0.6255450453999998
Mo Na O Zn,0.6255211191533335
Br Mo Nd O,0.6254794574666669
Al Fe Ni U,0.6254547570466658
As K Nb Pb,0.6254235700666664
B Ir Nb V,0.6252938262333334
B C Co Y,0.6252336423333337
Mn Mo O Sr,0.6251894886666668
Ba In Nb O,0.6251613578999996
Mo O Se Sr,0.625148238266667
C Cl H Ta,0.625141338966667
C Gd Na O,0.6250461970533336
Ca Nb O Si,0.6250145657166668
Gd K Mo O,0.6249927260333332
B Fe Nd Ti,0.6249711959666671
La Nb O V,0.6249575667866671
Mn Nb O Zr,0.6249418159000003
Ca Ga O Sm,0.6249251623466664
Ca Li Nb O,0.6248481659833331
Ca In Nb O,0.6248409994133336
Al Dy Fe Tb,0.6247848071166667
As K O V,0.624761025333333
Cu Na O S,0.6247545111666668
Fe Pr Ru Si,0.6246561304999999
Mo Pb S Se,0.6246093916333332
Ca Dy O V,0.62457523098
Cs Nb O V,0.6245589757533334
C K O W,0.6245343603666667
Mo Nd O Tl,0.6244960647666665
Al Ba H O,0.6244862578666666
Al Fe Si Tb,0.624445420633334
C H Ho O,0.6244423639333331
Fe Ge In Nd,0.6243059777633332
Ca Gd O V,0.6242857293499998
Ce Fe Ge In,0.6241714422333328
Li Mo O Se,0.6241535973666665
As Ba K O,0.6241274391666665
Ba Nb O Sr,0.6240707496333338
As Mo Na O,0.6240162253700003
I Mo O Rb,0.6238742431999995
Ca Ga O Pr,0.6238379766900002
Nb O Sn Sr,0.6237778727099996
B Ge Mg Rh,0.6237749306666668
Ce K Mo O,0.6237559258666665
N O Pr Ti,0.6236574678666662
Cu F O Ta,0.6236502634000002
Ba Ca In O,0.6234758564466667
Co Er Fe P,0.6234581867666666
Cs Mo O Se,0.6234042856333329
Cr La Mo O,0.6233971742499999
O Rb Si V,0.6233389892333338
B Ir Mg Zn,0.6233226396
Ba Cr Nb O,0.6233163218933337
N O P Th,0.623309918116667
Mo O Se Tl,0.6232757320166671
Mo O Sr Zn,0.6232702270133342
Cs H Mo O,0.6232445497666671
K Na O V,0.6232389753000003
H Mo O Sr,0.6231488479500004
Ba Ca O Te,0.6230998835999998
Cl K Mo O,0.6230953775466662
C O Sc Sr,0.6230727728999997
Mg O P Zn,0.6230639067833337
As Ca K O,0.6230592681333336
Ba Mo Pb S,0.6230238272333334
Mg O P Sr,0.6229902065166658
C H O Pr,0.6229825762866665
Eu N Si Yb,0.6228795749000002
Ca O Tm V,0.6227795077333337
K Mo O Sc,0.6227279542166667
Er La Mo O,0.6226868922999993
Ba Bi Nb O,0.6226559229666666
Ga K O Se,0.6226376553666666
Mg Nb Ni O,0.6224238058900002
Bi La Mo O,0.6224060137000001
Bi H Mo O,0.6223872452000002
K Mo O Sm,0.6223690507666663
Ba Nb O Si,0.6223423675333333
Li Mn O V,0.6222483184999997
Al Cr V Zr,0.6222064665333333
B Ce N Ni,0.6221805376666668
C H O Si,0.6221090023433336
Ba Li Nb O,0.6220973386166665
K Mo O Pb,0.6220337338000003
Co Fe La Ti,0.6220011077333335
La Mo Na O,0.6219923310666666
Ca Nb O Sr,0.6219636617900003
Ca Ce O V,0.6218582379333335
Bi Mo O Rb,0.6218373571000005
C Cl Cs Sc,0.621811541566667
C Dy H O,0.6218076996999999
Ca Cl O V,0.6217698518666669
Cu O P Th,0.6217367486999994
Cu Ni O Sn,0.6217024437500003
As Cs Mo O,0.6215342828166666
Mg O Sr W,0.621494076023333
Fe Ge In Pr,0.6214819322166669
La Li Mo O,0.6214256896666661
C Gd H O,0.6213718847666666
Ce N O Ti,0.6213657317500002
C Cl K Pr,0.6213259568666668
C H P Sn,0.6213257773333329
B Fe Ho Nd,0.6213196405999999
Cu O W Yb,0.6212625456999998
Cl In Li Nb,0.6211871672499999
Br C H Si,0.6211703141333331
C Nb Ni Ti,0.6211696070666668
Ba O Pb V,0.6211489636333335
Ga Li Mn O,0.6211407053166664
Er Mo O Rb,0.621081784886667
Al Ca Mn O,0.6210733911333337
H Mg O S,0.6210505256866667
Al F Li Mg,0.6209809422499996
Ce Mg O P,0.620955987356667
C Ni Ta V,0.6209429210999999
Cu K Nb Se,0.6208908911200004
As K Nb Tl,0.6208421054333332
Li Mo O Zn,0.6208384100333335
B Fe Ge Nd,0.6208251752666669
K Mo Na S,0.62075041
As B Ir Mg,0.6207228603000007
Cs Mo O Rb,0.6205927008666671
Cu Li O Ti,0.6204975990000001
C Nb Ni S,0.6204267760966666
B C Pd Y,0.6204136374000001
K Nd O V,0.6203475857533338
Mn Nd O V,0.6203399072999998
Ba O U V,0.6203343786333332
C Cl H Si,0.6201956178800002
Ba Nb O Te,0.6201928490166666
C Ce Na O,0.6201508156866665
Ba Hf Nb O,0.6201439712666663
Co Ga S V,0.6201383410333335
C H Si Sn,0.6200816865666664
Mg O Pb U,0.6199847729333331
Mo O Pr Rb,0.619978481
Mo Na O Sr,0.6199437774200001
Co Fe Nd Si,0.6199369262333336
C Cs O Pr,0.6199105501000001
Cs Mo Nd O,0.6198868157666662
As In K Nb,0.6198798587133333
Cd O V Y,0.6198692762333339
C Ge H Sn,0.619866366133333
C Cr O Te,0.6197659150466671
B Ga K O,0.6197438765733333
Ca O Pb V,0.6197367535666665
Mn Mo S Se,0.6196183344
Cs Mn O V,0.6195898023666666
Ba H Hg O,0.6195680623666671
Cl K Nb Sr,0.6195479454666664
Mo Nb O P,0.6195213891366665
Ag N O S,0.6195045174599996
As Li Mo O,0.6193877095666669
O Se V Y,0.6193155939499994
K La O V,0.6192883669333334
Bi Mo O Se,0.6192763366833332
Gd Ir Mg O,0.6191103725333336
Ga O Sr Y,0.6191010983833333
Br C H Pt,0.6190736313333335
Ce Fe Sb Yb,0.6190244700333335
Al C O Si,0.6189718365366667
As K Nb Se,0.6189581938300002
Ca O V Yb,0.6189245431333332
In Mo O Rb,0.6188913565000007
Cu K Mo S,0.6188909335666669
B Mg P Rh,0.6186413252666666
B Fe Gd Nd,0.6185910208333336
C Cs Gd O,0.6185876030000002
Cu O S Tl,0.6185805190000003
Ca Li Mg Zn,0.6185079653499993
La Mn O V,0.6184644105999996
Li Mo Na O,0.6184545482999999
Cu Nb S V,0.6184220418000002
Cu O P Pb,0.6184196058000001
C La Mn Sn,0.6183111220000003
C I O Pt,0.6183092428000002
C K O Pu,0.6181002575999999
As Na Nb Sr,0.6179794691666666
Ba Eu Nb O,0.617959681433333
C H O U,0.6179102800133331
Nb O Ta V,0.6179062160000004
K Mo O U,0.6178570715333329
Ba Lu Nb O,0.617852838
C Mn O Re,0.6177980315833335
Bi Co Fe Tb,0.6177818603133328
Br Cs Mo O,0.6177482729666666
Mg O Ti Y,0.6176511638
H O Rb V,0.6176080755000002
Er Mo Nd O,0.6175885440333336
La Mo O Sr,0.6175713768333332
As Bi Mo O,0.6175627215899999
Ba C F O,0.6175593425666668
Co N P S,0.6175197960533332
Bi O V Y,0.617516656433333
C H O Pb,0.6174474907666664
C Co K O,0.6174384234999997
Cu La O Ti,0.6174047677333333
Mo Nd O Te,0.61735341821
C H O Tm,0.6173237893999999
C H O Yb,0.617265451
Ba Ca O Ta,0.6172633312333332
B Fe Nd Tb,0.6172492833000001
Ag Mn Mo O,0.6172221751333331
Ca Lu Nb O,0.6172022268666663
Ba Mn O Y,0.6171812671333337
F N O Re,0.6171565549333335
Ba Nb O Sm,0.6171306700333329
Mo O Pb Se,0.6170510500666669
Br Er Mo O,0.6169616356000002
In K Mo S,0.6169606005999999
Mn Mo O Te,0.6169363557233335
B C Cr Mn,0.6168513016666666
C Na O U,0.61685014352
Ba Cl O V,0.6168384549666668
Cd Cu O Ti,0.6168223470666663
Ga K O Te,0.6168099221666666
Ca O Th V,0.6168025829000003
Na O Si V,0.6168016860333336
C H O Pd,0.6167258625166668
As Mo O Sr,0.6166970941999996
Eu Li Mg Sn,0.6166748118166666
Mn O V Zn,0.6166501376999999
Ba Ca O U,0.616646711146667
Cs Mo S Se,0.6166442692000002
Ba Nb O Sc,0.6166030959999993
Er K O V,0.6164677821666671
C Cl H O,0.6164028657666673
I K O V,0.6163915262333335
Er O V Y,0.6163662935499999
Bi Cu O Ti,0.6162620992999996
Cs I Mo O,0.6162552177333334
B Br C La,0.6161931079333332
Br C H P,0.6161879466333333
C H I Pb,0.6161598237999997
Cs Mo O Zn,0.61608366522
Cl Mo S Se,0.6160720630000005
B Fe Gd Ni,0.6158582132533336
C Cl H P,0.6158297817000001
Co Mg O Si,0.6157454953333334
C Ce H O,0.6156833339133333
Cr Fe Ni P,0.6156754532333334
B C H P,0.615584578
Ca Ho Nb O,0.6155187860733327
As K Nb O,0.6155010252666663
Ba Ho Nb O,0.6154586995666669
N O S U,0.6154438854033331
Cd K O V,0.6153654871999997
N O Sb Th,0.6152859118533334
I Li Mo O,0.6152472654666664
Cr K O V,0.615242708233333
H Mo O Si,0.6151845265799997
Li O Si V,0.6151613240999998
O Te V Y,0.6151290930000005
B Ba Ca O,0.6150755861666664
Br C O Pb,0.6150442301833337
Co Er Fe Pr,0.6150387292333332
Li O Rb V,0.6150348699333341
Ba Nb O Pr,0.6150187996166671
Ba Ca O Tm,0.6149425851866669
Mo Nd O Si,0.6148081606666664
Mo Nd O Pb,0.6147929966999998
Cl Cs Mo S,0.6147678851666667
Nb O Sr Y,0.6147673630000006
Dy N Si Sm,0.6147664150333332
Mo O Rb U,0.614706412766667
Al Fe Ni Ti,0.6146956776000001
Ba Nb O Pb,0.6146184597999996
B C F K,0.6145879151666667
Co Cu O Sb,0.6144412274333334
Ba Mo O P,0.6144242395866669
C Co Hg O,0.6143505187333335
Er Mo Na O,0.6142516497333336
Ca Nb O Ta,0.6141801495799998
Cu O Pr S,0.614126458286667
C H O Rh,0.6140611625666669
Li Nb O Y,0.6140143871666667
H K Nb O,0.6139725605000006
Co Ge Mg O,0.6139055298466665
Li Mg Pt Sn,0.6138488427166664
Ba Dy Nb O,0.6138485313666662
K Li O V,0.6138186426666666
C H O Th,0.6136763387333343
Cu Nd O Ti,0.6136169504666669
Cs Li Mo O,0.6135641739200003
Nb O Zn Zr,0.6134388987666671
Mo O Sc Zn,0.6133784695666672
Mn O Sr V,0.6133423290533327
Cd Cs Mo O,0.6133144174000003
Eu H Mo O,0.6132259658333334
C Cl Na W,0.6131645142000001
C Cs O U,0.6130760161200001
Bi K O V,0.6129220119666673
C H S Sn,0.6129061779666665
Cr Mo Na O,0.6128933329333333
Br Cs Mo S,0.6128933019666668
Al Mo O P,0.6128227030833333
Cu Mo S Se,0.6128215202000004
N O Pd S,0.6127770275200004
Cu Ga Mg Sc,0.6126954776200001
B C Cl La,0.612667649266667
K O Sr V,0.6126496128000002
Ba Bi K O,0.6126432501666663
Ba Ga Ge Mg,0.6126410763466665
Cr Fe Ni U,0.6126409603666672
As Ga H O,0.6125382028666665
Ag La Mo O,0.6124638497333333
Bi Mo Na O,0.612399199416666
Ba Gd Nb O,0.6123655656000001
In Mo Na O,0.6123047220333329
Mn Nb O Zn,0.6121876249000002
B Fe Si Tb,0.6121433246000002
In Mo S Se,0.6121322136
Cu Mo Pb S,0.6119900955333336
Al Ca Na O,0.6119793257466665
Mg Mn O Ti,0.6119749352200003
K Mo O Yb,0.6119045709833333
Cr Li Mo O,0.611847906833333
Ga Mg S Sc,0.6118170581333333
Fe Ni Ti Y,0.6117557661333333
H Mo O Sm,0.6116425057166667
H Mo O Pr,0.6116308017
Bi Li Mo O,0.6115695528500001
Na O V Zn,0.611542916666667
Ba Ca O Yb,0.611468379633333
Ce Nb O V,0.6114411915166669
Co Fe Nd Sm,0.6114268944333336
Li Mo O Sr,0.6114127188
C Dy I O,0.6114051376999999
N Ni O Pb,0.6113846801466661
Al C H Si,0.6113837397666664
K Na Nb O,0.6113566598333331
Al Ba Mn O,0.6111667847666663
C H I Si,0.6111445789666666
Bi Mn O V,0.6111392098333334
Bi Cs Mo O,0.6110569506000002
Cs Mo Na S,0.6110282434333334
H Na O V,0.6108812895666667
Al Nb O P,0.6108292388733337
Ga La Mn O,0.610793953766667
Mo O Te Zn,0.6107479903300002
Fe Ni P S,0.6107215008000003
In Mo Pb S,0.6107095636666665
Na Nd O V,0.6106491467
C Cs O Rh,0.6105797491666664
Ba Ce Nb O,0.6104880957666672
Ga Mn Nd O,0.6104845825299999
As Na O V,0.6104432064000002
Al Ga Li O,0.6104239398000001
Cl La Mo O,0.6104022334999999
Cu Ni O Te,0.6103884755999999
Gd Mo O Se,0.6103538869999999
Ag Mo O Se,0.6103142011533331
Ga Nb O Ti,0.6102768457066664
Mo Na O Te,0.6102003745399998
Ba Nb O Yb,0.6100929516
F N O P,0.6100781054166666
Ba Cr K O,0.6100530141666664
Al Ca Nd O,0.6099658106000003
Ba Nb O Tm,0.6098392565000004
Ag H Mo O,0.6098113023999996
I O Rb V,0.6098048184999999
O Si Sr V,0.6097619771999998
As C F H,0.609745347846667
Co Fe Sb Ti,0.6097094065999998
K Nb Nd O,0.6095354150199999
Gd Mo O Rb,0.609399591133334
Li Mn Nb O,0.609323425816667
Ca Mn O Y,0.6091987480399994
Dy H Mo O,0.6091976206666665
Ba Co Mo O,0.6090679527333335
H Nb W Zr,0.6090382145666663
Ba Ga Ge O,0.6090304318666665
Ga H Li O,0.6089631396199998
Er Mo O Sr,0.6089555468666664
K O Se V,0.6088968964666663
La Mo O Te,0.6088703146833339
Cu H V Zr,0.6088636273666669
Gd H Mo O,0.6088582970666668
F N S Sb,0.6087793258333337
Cu Np O P,0.608706620666666
Li Mo O Tl,0.6086513757500004
La O Si V,0.6086318703
C H O Tc,0.6086211872000005
Ce Cu O Ti,0.6085242804333333
C H O Re,0.6084277657
Bi Nb O Y,0.6084096540833333
Nd O Si V,0.6084048353333338
Co N O S,0.6083900437566666
As Na Nb O,0.6083530762000002
Br C O Tc,0.6083192687000001
C Ce Cl K,0.6083149168666666
O Rb Sr V,0.6082971103999997
C H O Ru,0.6081443893666668
F N O Sb,0.6080481668700001
Cu O Sr Ti,0.6080061682999999
F N O W,0.6079201393000004
Nb O Te Y,0.6078970886133329
Mo Na O Pr,0.6078804642133329
In Li Mo O,0.6077744499966667
Cl Cu Nb Rb,0.6077327502533332
Ag Hg O V,0.6076708032666661
Co Fe Si U,0.6076412030333336
Hf Mo Na O,0.6075799699533332
B Dy Fe Tm,0.6075792701333329
As Ga Li O,0.6075613777333334
Ca Ga O Si,0.6075097448700002
Cl Mo Nd O,0.6074997086666665
Mo Na O Sm,0.6074970337700002
Ba Ca O Si,0.6074500896666668
Cu O Ti Zr,0.6074470882000003
Ba Ga O Si,0.6074350648333334
Cs Ga O Rb,0.6073522298333331
Al Ca O Zn,0.6073468723999997
H Mo O U,0.6073292465
Ce H Mo O,0.607309864466666
Ba H O Zr,0.6073004282333335
F N P S,0.60725595342
Nb O Pb Sn,0.6071873885000001
K Mo O Th,0.6071790781000004
Cd O Rb V,0.6071333683666665
Ca Ga Ge O,0.6070840372633345
As C O W,0.6070828847333328
Cr Mo S Se,0.6070564860333332
O Rb Se V,0.6070304389533334
Mo Na O Sc,0.6070195110666671
Cl H Mo O,0.6070090102166668
B Ir Mg P,0.6069257104333339
Ca O Pd V,0.6068959028666663
As Ba Hg O,0.6068647788666667
Cr Mo O Sr,0.6067272864333333
H Nd O V,0.606718967316667
La Mo S Se,0.6067047981666667
Ge K O V,0.6066869364666669
La Mo O Si,0.6066350824999996
Ba Ga O Ru,0.60658261633
H La O V,0.6065494492033334
Gd O V Y,0.6064968066333335
Ba O Y Zn,0.6063925249000002
Cl Mo O Se,0.6063736744
Al Au Ca V,0.6062956048666664
Ga O Sc Y,0.6062716717000001
Br C O Ru,0.6062702428333333
Fe Gd Ge In,0.6062542498666668
B Be C H,0.606251139533333
B C H Ni,0.6061607170666662
Al Ca Cr O,0.6059542397633331
Li Na O V,0.6059161678800002
Mn Nb O Sr,0.6059030462733334
Ba O Sn Y,0.6058471554499998
C Co O Rb,0.6058216469399996
Br Mo O Te,0.6057662958333333
Ga H Na O,0.6057476701000002
Na Nb Nd O,0.6057265084666663
C H O Os,0.6056347506799997
Ag As Mo O,0.6055500315999999
K La Nb O,0.6055206009099999
B C H S,0.605512167086667
Cr O Rb V,0.6054667918333332
F Mg O Si,0.6054217585333334
Cs Mg O Ti,0.6054199258
Er Ga Mn O,0.6054028438199999
O Sr V Zr,0.605356919866667
Al Ca La O,0.605328210783333
As H O V,0.6052813185333329
Ho Mo Nd O,0.6052795613999997
B C Cl O,0.6052652100800002
Hf Li Mo O,0.6052108919333336
Eu Mo Na O,0.6051988277666667
Al Ba Nd O,0.6051173837533335
F Ge Mg O,0.6050348766666667
Eu K O V,0.6049640749666666
Ba H Mn O,0.604916880433333
Au C Cl O,0.6049006462199998
Mn O Te V,0.6048911290000005
Cl Cs Nb Pb,0.6048786282166667
H Li O V,0.6048480902999998
Br C O Re,0.604781976546667
Ga Mn O Sr,0.6047135687666667
Nb O Sr Zr,0.6046721486466666
B Nb Ni V,0.6046344608133332
Gd Mo Nd O,0.6046321285999999
Mo O Rb Th,0.6045734895666671
La Mg O Ti,0.6045457515633335
Cu O Sb Si,0.6045325724866669
Ga S Ti V,0.6044831791166665
Eu Li Mo O,0.6044191337666664
Br Lu Mo O,0.6044121298333335
Al C Er H,0.604400686866666
H Nb O Rb,0.6043388096666668
Nb O Y Yb,0.6042887722666671
Fe Hf Ni Sb,0.6042622584333338
Mo O Rb S,0.604216186
Ca O Tb V,0.6042137274133329
B Cu Ir Mg,0.6041004924999998
As Ca H O,0.6040983634333333
Br C H S,0.6040856533999999
H O V Zn,0.6040804264666667
Cr Mo O Tl,0.6040463423533331
Ca Li Mg Si,0.6040406457499997
As Cs In Nb,0.6040128718999995
Mo Na O U,0.6039932675666669
Co Er Fe Ti,0.6039675989666663
Mo O Sc Sr,0.6039633424999999
H Na Nb O,0.6039383585666669
K Mo O S,0.6038565090533339
Cu Er O Ti,0.6038548369666669
Ag K O V,0.6038099812999999
Bi Mn Nb O,0.6037623508666665
B Cu O Ti,0.6037550396166669
La Mo O Pb,0.603632560666666
Cu F O P,0.60361289385
B Ca K O,0.603536194266667
Br C O Os,0.6035287315000001
Lu Mn O V,0.603414847766667
K O Sc V,0.6034032897666671
Ca Nb O Th,0.6033506221166669
C O Tl U,0.6033260708333331
Au Ca H O,0.6032966399999999
Br Mo O Pr,0.6032635020333336
B C I La,0.6032276501333329
Mo S Se Tl,0.6031712373666667
Ho K O V,0.6030842461866661
Ag Mo O Zn,0.6030491161466665
Mo O Pr Tl,0.6030450238999998
Br C Gd K,0.6030064416666667
Cu O Tb W,0.6029784873000006
Mo O Os Sn,0.6029693281666667
Li O V Zn,0.6029389499333333
Li Mo O Te,0.6029334111333333
Mo O Sm Sr,0.6029219513000004
Ba C Ni O,0.6028907823066667
Ga Ge K O,0.6028231352833338
C F K O,0.6027663546733334
As Cs Nb Se,0.6027617388333338
Lu Mo Na O,0.6027512366666665
Au Mg O S,0.6026841691666667
In Mo O Tl,0.6026221650500007
Cr Ga Li O,0.60259089842
Br Ca H O,0.6025740686666671
Al Ga Na O,0.6025542510133338
Al H K O,0.6025465978000003
F Mo Nb O,0.602541792546667
Ho Li Mo O,0.6024748792499999
Dy K O V,0.6024659810166666
Ag I Mo O,0.6024264264666663
C Mn Si Sn,0.6023216386333332
C H O Tb,0.6022996484166668
La Na O V,0.6022962517833328
Cs Na O V,0.6022959059333332
H Ir Li Mg,0.6022849386466668
Ba Mn O Rb,0.6022751895333336
Al Ca O Sn,0.6022698767533332
B C Co H,0.6022413830333329
K Mo O Re,0.602240008766667
H I O V,0.6022137579666672
Li Nb O Zr,0.6022103681466673
Br Mo O Sm,0.6022058087800002
Ba Nb Rb Se,0.6021073005666664
Fe Nd Os Si,0.6020977361666671
Br Dy Mo O,0.6020417360833332
Ba Ca O Os,0.6020346297000002
K O Te V,0.6020285393966667
Bi O Si V,0.6019932983666662
C F H Sn,0.601989361386666
Ag Mn O V,0.601912905633333
Br Ho Mo O,0.6018955630333334
C Cr Si Y,0.6018558986333338
Cr Si V Y,0.6018556565999998
B C Cs F,0.601838122526667
Hg Mo S Se,0.6018247601333327
As Nb Rb Se,0.6018234697666667
As C Co O,0.6018206410999999
Al Ba La O,0.6017905222333327
Al Ca O Sr,0.6017267698666666
Bi Ga Mn O,0.6017108818133335
Ca O P V,0.60164655915
C H O P,0.6015505110300001
Li Mo O Sc,0.6015070156700002
Ba Nb O Ru,0.6015005600666667
Cl Cs Mo O,0.6014657711466669
Cs Hf Mo O,0.6014330279866668
C Cu H S,0.6014028307666671
Cs Ga Li O,0.6014003152
Gd Mn O V,0.6013880036666662
C F Hg O,0.6013864807333336
Cr Mg O Ti,0.6012862484999997
Ga Li Na O,0.6012722228666664
Cs Cu Nb Se,0.6012625004666667
Cr K Nb O,0.6012461655133331
Br H O V,0.6012320042333338
Ca H Mn O,0.6011526382133328
Cs Eu Mo O,0.601131510933334
Co Fe Gd Si,0.6011308420666664
Mg O Ti Zr,0.6011288305999997
Co Fe Tb W,0.60110740568
Ag Mo Na O,0.6010856616666671
Cu Na O Ti,0.6010174261333335
C Cl Cs Lu,0.6008415998999997
Ba Li Mg Si,0.6008200513633332
Co Mg O P,0.6008097442466674
K Lu O V,0.6008069500133332
As Cs O V,0.6007877602000001
C O Si Sr,0.6007509868700005
Cd Mo O Te,0.6007241628833333
Fe Ge La Ni,0.6007137302500001
Br C Cl W,0.600677553733333
Cr Sn V Y,0.6006528624
Na O Sr V,0.600533080966666
Mo O Sc Tl,0.6004581542000005
K O Ta V,0.6004092054999998
Mo O Pb Sr,0.6003889810833334
Ga H O Se,0.6003575929
Br Mo O Pb,0.6003542342333333
Cs Mo O Te,0.60019848825
C I O Rh,0.6001875667000004
Eu Mo O Sr,0.5997787369800001
C Cl Nd Rb,0.5997545367000001
Ba O P V,0.5996951291000001
Ba Ca O Ru,0.5996910875333336
Ga Li O Se,0.5996161212133334
Mo Nd O Th,0.5996156173999999
B Ir Mg Si,0.5995176941499998
As Cs Ga O,0.5995032843133337
K Nb O Si,0.5994845089666667
Cu Nb Rb Se,0.5994335947666667
Mo O Sm Tl,0.5992342355233331
Cs H O V,0.5990456018000004
Cl Er Mo O,0.5990140696833333
Gd Mo Na O,0.5989924784999999
C Co Li O,0.5989858038133332
C I O Tc,0.5989715553166661
H O Sr V,0.5989651548
Al Ba O Zn,0.5989598786466669
In K Mo Se,0.5988806281333335
Mo O P Zr,0.5988768208033334
Al O P V,0.598839901256667
Li Mg Ni O,0.5988006279366658
Ba O V W,0.5987862290000009
Ca Cl Mg Na,0.5987659802600002
Ce Nb O Y,0.5987173409999998
Ba Ca Ir O,0.5986692619000001
Cr Fe Ni Ti,0.5986336096133335
Mo O Tl U,0.5986271624333329
K Mo O P,0.5985664096666666
C I O Ru,0.5985337441300002
Mg O Pb W,0.5985203532999998
Eu Mn Nb O,0.5984868483566669
As Li O V,0.5984560412
Ce Li Mo O,0.5983329908666668
B La Mo O,0.5983212036633334
Bi K Nb O,0.5981530036466667
Br C O W,0.5981049303899997
Ba Ca O Re,0.598089293546667
Ba Ir Nb O,0.5980509410333333
H La Nb O,0.5978680282166665
Nb O Rb Sr,0.5978501551000003
Br Gd Mo O,0.5977501388166668
Ca Li Mg Sb,0.5976349745166664
Ca O Sn Y,0.5976197469433331
C O Ru Se,0.5975847945666665
Al Ga O Sr,0.5975485997933333
Ce Fe Ni Sb,0.5974608584999997
Er Na O V,0.5974479508333335
Bi O V Zr,0.5974399455666668
As O Sr V,0.5974211502999996
Eu Mo Se Sn,0.5973608764666666
Ca Ge Li Mg,0.5972110491166666
K Nb O Se,0.5971158312866669
Ce Mo Na O,0.5970841735000001
Cs Dy Mo O,0.5970387242766668
As Cl Nb P,0.596954765286667
Mo O Pr Te,0.5969341104566663
Bi Mg O Ti,0.5969037334966666
Co Fe Sm Ti,0.5968782394199997
C I O Re,0.5968219809333332
Li Mo O Ta,0.5968072160333331
Li Mo O U,0.5968060586999997
H O Se V,0.5967913005166671
H Mo O Th,0.5967491385500004
In Li Mo Se,0.5967366043
H Nb O Si,0.5967164004466671
Ga H O Sr,0.5966845055533335
Cs Mo O Pr,0.5966747505333335
In Mo O Te,0.5966639052333336
Ga K O Si,0.5966602241466664
Cu F O W,0.5966547094999997
H Mo O S,0.5966499218999999
Ho Mo O Sr,0.5965750974866666
Hf Mo O Tl,0.5965412520833336
Eu Mo O Tl,0.596536793833333
K O U V,0.5964639003866667
C S Ti V,0.5964499738666665
Co Fe Ge U,0.5963086481999998
B Ba K O,0.5962931956666668
I Li O V,0.5962823374499998
Mn O Pb V,0.5962815481666668
Co K Mo O,0.5962801553666668
Nb O Rb Si,0.59623376555
La Na Nb O,0.5962283028799995
Bi Mo O Sc,0.5961869472666665
I O V Zn,0.5960867760333335
C O Os Se,0.5960681588833335
Ga Mg S Ti,0.5960496708533332
B Ga O Rb,0.5959976472333331
Gd Nb O Y,0.5959484878166664
O Sr V Zn,0.5959129208666665
Bi Nb O Zr,0.5959058002666666
Cd H O V,0.5958999243666667
B Ga H O,0.5958859656999997
As Ba H O,0.5958461162666671
O Pr Si V,0.5957873874000004
C Cl F H,0.5957507413333331
K O Pb V,0.5956073313666667
Br Ce Mo O,0.595600471356667
F Mo O Y,0.5955771856233335
Ho Mn Nb O,0.5955752941733334
Al Ca O Te,0.5955039473333332
K Nb O Sr,0.5955006915533329
Er H O V,0.5954798928166665
Mo Nd O Re,0.5954282550999999
K Li Nb O,0.5953574993999997
Mg Na O Ti,0.5953102007000002
C Co Na O,0.5952990284666665
Cd Na O V,0.5952963573666666
C F Mn O,0.5952646090833333
C H Si Te,0.5952146082333334
B Mo Nd O,0.595131563763333
Al B Ga O,0.5951122632733336
Mn Nb O Ta,0.5951014855266665
Gd Mo O Sr,0.5950713138666668
K O Tm V,0.595059933233333
La Nb O Rb,0.5950458702666667
I La O V,0.5949646019666666
La Li O V,0.5949642649499999
Mg Nd O Ti,0.5949488587833333
C Cl O Pt,0.594911052566666
Mn O Y Zr,0.5948591277333333
Ba O Sn Zr,0.5948453490000005
B Cr Ir Mg,0.5948119198666667
B O V Zr,0.5948107636400003
Dy Mo O Sr,0.5948050292466662
O Rb Ta V,0.5947761171466667
C H Hg Si,0.5947752941333339
Bi Mo O Pb,0.5945393103666665
Mn Nb O Pb,0.5945122054199994
Cs Li O V,0.5945018268333336
F N O S,0.5945000329533333
Fe Ni Sb Sm,0.59438043472
C I O Os,0.5943766000999998
Ba H O Sn,0.5941989794000002
I Nd O V,0.5941544353500002
Dy Er Mo O,0.5941502894633334
Ge K Nb O,0.5941227773133329
Be Ca O Y,0.5941034055333332
C Co H O,0.5940849629866664
C Cl Pr Rb,0.5940819214000005
Cs Cu Nb Te,0.5940238834000002
Al Bi Ca O,0.5940237057466663
Ag In Mo O,0.5939770943466665
Bi Na O V,0.5939198608833333
Ge O V Zr,0.5939155603666665
Ga La Nd O,0.5938078144966661
As Ba Mn O,0.5937971232333339
Ge Li Mo O,0.5937605039833334
Cs Gd Mo O,0.593758519033333
Ag K Nb Se,0.5937392859800003
Mo O Pr Sc,0.5937349200333332
Cs I Mo Se,0.5936386674333333
Cs I O V,0.5936279779166664
Ba Nb O Tb,0.5935146335666671
B K Nb O,0.5934278512333336
Cr Na O V,0.5933636626
Eu Mo S Se,0.5933386129333336
Ca Co Ga O,0.5933116742966663
Mo Na O Th,0.59324606042
O Se V Zn,0.5932091562300001
C F O Rb,0.5931357153799998
C H I Sb,0.5931253322333331
Na Nb O Si,0.5930878168666666
Na Nb O Sr,0.5930075080700005
Fe Ni Sb Yb,0.5929554976333332
Bi C Ir O,0.5929292637
Cs Mo O U,0.5929083886133331
Al F Mg Rb,0.5928928479333334
C Cs Er I,0.5928302881333329
Br Mo O Yb,0.5927234389666667
Al Mg Na Zn,0.5927212684099998
Br Mo O Tm,0.5926938267333332
Bi H O V,0.5926542019
Li Mo O Yb,0.5926003918666668
H Nb O Tl,0.5925634148166663
I O Tl V,0.5925578912499998
Bi C O Ru,0.5925385056466669
Ba Ge Li Mg,0.5925052131133327
Mg Na O S,0.592470652096667
O Sr Tl V,0.5924361028166666
K Mg Na Tl,0.592301630216667
Eu Mo Pb S,0.5922591002333333
K Mo O W,0.5922483439666664
Cr Li O V,0.5922401926466667
Ca Nb O P,0.5921520934299994
B H O V,0.5921281520366667
C H In Si,0.5920937118666662
Na Nb O Se,0.5920317612
Ga La O Sn,0.5920038537800002
Ag Mo S Se,0.5919790039666666
Mo O Sr Yb,0.5919385272000002
B Na O V,0.5918603460833338
Ba Nb O P,0.5918022761033337
Mo Na O S,0.5917871773266666
K Nb O Te,0.5917699571999999
Br Cd O V,0.591759218513333
Cs Mg Se Sn,0.5917568434033332
F N O Xe,0.5917300415366674
Au Ge H Nb,0.5917049275999994
Cd Gd Mo O,0.5917022992999997
C Cl Cs Gd,0.5916976312666662
K O V Yb,0.5916307075999999
Ag Mo Pb S,0.5916191648999998
Ag Ba Hg O,0.5916183581666669
Ba Bi O Y,0.5916110314166667
As Ca Na O,0.5915753672333331
Cu O Pr Ti,0.5915420342333336
Cs Nb Nd O,0.5915313822299996
K Mg S Sn,0.5914878626733335
Ca Co O V,0.5914637129866666
Nb O Rb Te,0.5914560506999997
C La Mn Te,0.5914360163333334
Ba Ca O Pd,0.5914253587999997
Eu Mg O Ti,0.5913796802833334
O Se Tl V,0.5913769284699998
Co Fe Si Ti,0.5913188851000002
Ba Co Ga O,0.5912299484866671
Al Ca O Ta,0.5911608501666666
Cu Eu O Ti,0.5911087923533335
Cu K Se V,0.5910547793499994
Bi C O Os,0.5909924049333333
H Nb O Sr,0.5909601187666667
Cl K Nb O,0.5909575592333334
Ca O Sn Zr,0.5908431502800001
Al C H Ho,0.5907930095333334
Ba Hg O Sr,0.5907862103333333
B C Co Mn,0.590725783966667
Cu O Sm Ti,0.5907076946666667
Cs H Nb O,0.590664291433334
Ga Na O Se,0.5906424529000001
Br C Cl Pr,0.5905785964333335
Na O Sc V,0.5905257242333335
C Co Cs O,0.5905124469199996
B Ga Li O,0.59049430794
Eu K Nb O,0.5904476034666665
Li Na Nb O,0.59043102402
C Cd H Si,0.5904308103000001
H Li Nb O,0.5904283945533334
Cd O Tl V,0.590352986633333
Ca H O Sn,0.5903486957666668
Br Mo Rb Se,0.5902959083
