phases,average probability Tc>10K
Cu Fe Mg O,0.8284694507666664
Ca Cu Fe O,0.8271188300333333
Ca Fe Li N,0.8263464657666665
Ba Fe Li N,0.8257273401000004
Ba Fe Mg O,0.823461820033333
C Fe K N,0.8213679165333333
Fe Li N Sr,0.8212770091666662
Ba Ca Fe O,0.8200875404666664
C Fe N Na,0.8195455588999995
Cl Fe N Se,0.8188023129666664
C Fe N O,0.818419516233333
C Cs Fe N,0.8165046922333333
C Fe N Y,0.8164697974333331
C Fe N Sr,0.8161371856999999
Al Fe Mg O,0.8156715558333331
Fe Mg O V,0.8154241042666671
Br C Fe N,0.8153600684666661
Fe N V Y,0.8152903946666666
Br Fe N O,0.815114421266667
Cs Fe N O,0.8149528018999999
C Fe N Sn,0.8147524040000003
As Fe K O,0.8147424808000002
Fe Mo N Y,0.8146299600666665
Cu Fe O V,0.8137921804333329
C Cu Fe N,0.8137308336999999
Ca Fe Ga O,0.8136759555666667
C Fe Mn N,0.8136179012333334
Cl Fe N O,0.8134515254999997
Cu Fe O Se,0.8130628468000001
Cu Fe O Y,0.8130550527
Ca Fe O Se,0.8127232307333333
C Fe Mg O,0.8125920724000002
Ba Fe Ga O,0.8121760380333336
Li Mg N V,0.8117905758333332
Ba Mg N Nb,0.8113847889333334
As Fe Na O,0.8113191950666667
Fe Li Mg O,0.811021270133333
C Fe N Tl,0.811001208866667
C Fe N Zn,0.8107793866000002
Fe Mn N Sr,0.8107264413666676
Fe H N Se,0.8105285485666675
Cu Fe Mn O,0.8099900600000006
C Fe H N,0.8098690287
Ba Fe O Se,0.8097909550333335
As Fe La N,0.8096685131999997
Fe Mg O Zn,0.8095896267333335
Fe Mg O Sn,0.8095637523999997
As Fe Li O,0.8094522849333331
Cu Fe Li O,0.8090072483999992
Bi Fe Mg O,0.8089362529999995
Ba Fe K O,0.8088438596333334
Cu Fe Mo O,0.8084411311666667
Cr Cu Fe O,0.8084003821000003
Cu Fe O Sr,0.8080403225333337
Fe I N O,0.8079463164000006
As Cs Fe O,0.807897597333334
Fe Mo N Pt,0.807683792766667
Cl Fe H N,0.8076467246000005
Al Ca Fe O,0.8074601305833333
C Fe N Pt,0.8072131467666662
As Fe O Rb,0.8069878647000003
Cu Fe La O,0.8068381210333331
Ba Ga Mg N,0.8064659038333333
Ca Fe Mo O,0.8063062646666667
As C Fe O,0.8059424420000004
C Cd Fe N,0.8058929040999998
Ca Fe O V,0.8058040401333332
Cr Fe Mg O,0.8057117077000001
C Fe N Pb,0.8056695141999997
C K N Nb,0.8055664203666668
Er Fe N V,0.8055430871666666
Cu Fe O Zn,0.805436791666667
As Fe La O,0.805419313933333
Br Fe H N,0.8054175792
Ag C Fe N,0.8052159537666665
Ca Ga Mg N,0.8051572656
Fe H N O,0.8049447806
Ca Fe O Y,0.804788354833333
Ba Fe O Y,0.8043748686333333
As F Fe O,0.8043475413333334
Ga Mg N Sr,0.8041930340666668
C Co Fe N,0.8040729394666667
Ce Cu Fe O,0.8037239361333337
As Ca Fe Na,0.8036251421666669
Ca Fe Na O,0.8034463684666661
Al Ba Fe O,0.8031339621333334
As Ba Fe K,0.8030802720333328
C Cl N Nb,0.8030452116333345
As Fe H O,0.8030244054999999
B Fe Mg O,0.8029736150666662
C N Nb V,0.8028494585666668
Ba C N Nb,0.802849316966667
C N Nb Zr,0.8028162972000005
Fe Ge N V,0.8027381405999999
Er Fe Mo N,0.8026539754333335
B Li Mg N,0.8026269247666664
Fe H I N,0.8023029385000005
Ba Fe Li O,0.8022799141666666
Ba Fe Mo O,0.802276250466667
Fe In Mg O,0.8022115878000003
C Er Fe N,0.8021417938000001
Dy Fe N V,0.8020026490000004
Ca Fe Nb O,0.8016545472666669
Bi Ca Fe O,0.8016418432333332
Ba Fe Mn O,0.8016268537333335
As Ba Fe Na,0.8013916510333334
H Li Mg N,0.8013904102999998
Fe N Sm V,0.8011534936666673
Ba Fe Nb O,0.8010237950666672
B Ga Mg N,0.801001931166667
Fe Mg O Sc,0.8009343476333333
Ca Fe Mn O,0.8007506092999996
Cu Fe Nd O,0.8007322997666664
Cu Er Fe O,0.8003078681333331
Fe Mo N Pd,0.8001308465999989
Fe N Nd V,0.7993624008333338
Fe Ga O Y,0.7992724266000004
Fe Mg O Pb,0.7992570706333334
Ca Cu Mg O,0.7991546100999999
Dy Fe Mo N,0.7991083906666665
Fe Mo N Rh,0.7990538386666662
C Fe N Sm,0.7990389661333327
As Fe Nd O,0.7990128154666667
Cu Eu Fe O,0.7987964414000001
C K Li N,0.7986783348000001
As Fe N Th,0.7986758133000008
Ba Fe O Sr,0.7986339453333339
Fe Mo N Sm,0.7985398184333338
Fe H N Te,0.798269670766667
Fe N Pr V,0.7982229882666666
Fe Ge Mo N,0.7981764837333334
Ag As Fe O,0.7981577284333333
C Li N Na,0.7981420223666666
Co Fe Mg O,0.7980527072333334
Ca Fe O Sr,0.7980444769999999
Ba Fe H O,0.7978846405333334
Al Fe Ga O,0.7978380585999998
C Fe O Se,0.7977611428666671
As Ca Fe Sr,0.7975712998666665
C Dy Fe N,0.7971686983666667
Fe Mo N Nd,0.7968549079333334
B Cl Mg N,0.7967869424999999
C K N V,0.7966860786666665
Cu Fe O Sm,0.7965061582666669
Fe Nb Se V,0.7964058716333334
Ba Fe La O,0.7963853230666671
Ba Fe O Sn,0.7962801811000002
Ba Br Fe O,0.7961257979666657
Fe Gd N V,0.7960735213333335
Ba Fe O Zn,0.7959786034666669
Ba Li N Nb,0.7958150184666666
As Ca Fe Rb,0.7958129247999995
Ca Fe O Sn,0.7957994738166664
C K N Na,0.7957638717333336
Fe K O Se,0.7956077131333329
Ca Fe La O,0.7955398782333336
Fe Lu Mo N,0.7955084353999999
H K Mg N,0.7954855255333328
As Fe O Sm,0.7954162490000001
Fe Ga Mn O,0.7952982628
C Fe K O,0.7952234120333329
B Cu Fe O,0.7950263054
C Li N Y,0.7949222048
Fe Mo N Pr,0.7949134947999993
Cl H Mg N,0.7947272114666668
B Fe N Y,0.794665261433334
Cl Fe N S,0.7945242197000001
Fe Ho Mo N,0.7944093787000002
Ba Bi Fe O,0.7943414565333333
Cu Dy Fe O,0.7942682856666671
As Ce Fe O,0.7940352670000003
As Ba Fe Sn,0.7939651836666669
Ba Fe O Te,0.7939331403666668
Al Fe Mo O,0.7938239204666668
Al Ba Mg N,0.7937292494666667
Cu Fe O Pr,0.7937253911333335
Ba Fe K Se,0.7936870569666662
Fe Gd Mo N,0.7936574639999994
As Ba Fe Rb,0.793490481966667
Fe Mg O Re,0.7934460395666667
Cu Fe Ho O,0.7933644624666664
Fe Mo N Ni,0.7932977590999999
F Fe H N,0.7931952631
As Fe O Pb,0.7930034816000003
Ca Fe H Mg,0.792940577833333
C Fe Gd N,0.7927844561333335
Ba Er Fe O,0.7924988417999995
C Fe N Ni,0.7924744583999994
Cr Fe Ga O,0.7923022225799998
As Fe O Pr,0.7922614359666664
Cu Fe Lu O,0.7922534962666662
Fe K Mo O,0.7922491860000008
C Li N Rb,0.7922367237000002
Ba Fe In O,0.7921834676666674
Al Fe La N,0.7921643827333336
Cl Li N Zr,0.7921158808333333
Al Ca Mg N,0.7919475780166668
Cs Fe K O,0.7918425324999998
Bi Fe Ga O,0.7915996963333332
Cu Fe O Yb,0.7915827251000002
Fe Li O Se,0.7915106139000002
Fe Na O Se,0.7913031343333338
Cs Fe Mo O,0.7912654071000005
Fe Mo O V,0.7911819887999996
Ba Fe Nd O,0.7911544457666667
Ba C N Na,0.7910565213999999
C N Nb Ta,0.7909838429666669
Al Er Fe N,0.7909832056000002
Br C K N,0.7909166042333333
Al Fe O Y,0.7908804440666669
C Hf N Nb,0.7908219022666665
Ba Eu Fe O,0.7906381215666667
Ca Fe Nd O,0.7906082359533333
Fe Mg O Si,0.7905692945000005
Cu Fe Gd O,0.7905599499333337
B Br Mg N,0.7903936783999995
Ba Ca Cu O,0.7903734327000004
C Fe Mn O,0.7902836647333329
Ca Cr Fe O,0.7902449740333342
Fe N Sm Y,0.7902196337999999
Li N Nb Sr,0.7901471757333342
Cu Fe Ge O,0.7901405150333337
Ba Cr Fe O,0.7900429680999999
As Fe Gd O,0.7900298582000005
As Ca F Fe,0.7900244431666662
As Fe Na Sr,0.7900114308666667
C Ga Mn N,0.7899967374
Al Fe Li O,0.7899581637133333
C Ga N Sr,0.7898267016999999
C Mo N Tl,0.7897999004666668
Fe Mo O Y,0.7897843670666668
Ba F Fe Mg,0.7897620563333327
F Fe Li Mg,0.7897305418666669
Eu Fe Ga O,0.7894270958666665
Al Mg N Sr,0.7894223160133335
Fe O Rb Se,0.7892125110333338
Ba Cl Fe O,0.7891959630666665
C Cs K N,0.7891652677000002
Er Fe Ga O,0.7889578165000005
Fe Mo N Tb,0.7888384143999995
C Cu K N,0.7887261385666663
Al B Mg N,0.7886899156333333
B Fe H N,0.7886767515666658
Cs Cu N O,0.7886579237666672
Fe Ga O Zn,0.7886307550333332
C Fe N Tb,0.7886057002666663
Fe K Na O,0.7885918934666666
C K Mn N,0.7885810376333333
Ca Cl Fe O,0.7885519640333334
C Fe N Tm,0.7885227307666663
C Ga H N,0.7885205136333334
Fe O V Y,0.7884164987666662
Al Fe Na O,0.7883089332333338
Fe Na O V,0.7882966349999997
Cu K N O,0.7882240372000003
Fe K Li O,0.7881831212000004
Fe Mn Mo O,0.788101365333334
As Ca Fe Pt,0.7880361808666663
B I Mg N,0.7878945867333335
Fe K Nb O,0.7878480108999992
Al C Li N,0.7877816374666666
C Cl N Sr,0.7877039952333329
Ba F Fe O,0.7876638542333332
C H Li N,0.7876356261999998
C Cs N Na,0.7875458284666662
C Ca Cu O,0.7875215327666666
Ba Li Mo N,0.7874522782000003
Fe Ga La O,0.7873840609866667
Bi Fe O Se,0.7873785385666662
Al Fe N Sm,0.7873657150000004
Fe Mo N Tm,0.7873276083333328
Fe Li O V,0.7872283410666673
C Fe O Sr,0.7872012499799997
Fe Mn O V,0.7870253185000006
Fe O Se Sr,0.7868629769333333
Cs Fe Nb O,0.7868132375000001
Bi Fe Mo O,0.7867602732000006
Fe Li Mo O,0.7866468906333338
Ba Fe O Sm,0.7866162052666662
Cu Fe O Tm,0.7866128084666664
Mg N Nb O,0.786608278066666
C I K N,0.7865080806666669
Cs Fe Na O,0.7864200199999998
Bi Fe K O,0.7860122780666665
Fe H O Se,0.7859868339666667
Ba Fe O Ta,0.7859030474000003
C K N Se,0.7858829054333331
Fe Mo Na O,0.7858097366
Br H Mg N,0.7857195974333331
Bi Fe O V,0.7857098447333336
Al Cu Mg O,0.7856189971000005
Fe Ga In O,0.7856006212000006
Al Dy Fe N,0.7855735617666665
As Ca Fe La,0.7855613058666664
C Fe O Sn,0.7853885672666662
Cu Mg O Y,0.7852555528000008
As Ba Fe Pt,0.7852390020666661
Cl Cu N O,0.7851264194666666
Cd Fe K O,0.7851242116333339
Ba Dy Fe O,0.7850689949333339
Fe Mn O Y,0.7849381296000005
Cu Ga Mg O,0.7849268910333335
Fe Mn Nb O,0.7848911542533336
Fe H O V,0.7848205001333333
C H N V,0.7847778938999997
Fe O Se Zn,0.7847746142000003
Cs H Mg N,0.7847700369333332
H Mg N Rb,0.7847443775666673
Cr Fe K O,0.7846439118666666
Fe H N S,0.7845655871666661
F Fe O Se,0.7845324552666669
Ca Ga Li N,0.7844947371
Fe K O Rb,0.7844048163000006
C H K N,0.7843855340000001
Fe Mg O P,0.784310815866667
As Cr Fe Ga,0.7842862044333332
Fe Li Na O,0.7841667420000001
Cs F Fe Mg,0.7841579683000002
C K N Zn,0.7841560954666661
H I Mg N,0.7840678534666667
Fe N Ti Y,0.7840459514666659
Al Fe O Sr,0.783950083933334
C Fe H O,0.7839130221666669
C Ca N Sr,0.7838561053333334
Cu Mg O V,0.7837896538
Ba Fe O Pb,0.7837533528666667
C H N Na,0.7836256281666668
Fe La Mo O,0.7835065492333337
Ba Fe O Pr,0.7834538917666666
Ba Fe Lu O,0.7833577360000002
Ba Fe Ho O,0.783311507
Ca Fe O Pr,0.7832852954999997
Ba Fe O Yb,0.7832815090666674
Fe Mo O Sr,0.7832524081999991
Co Fe Ga V,0.7832454488333335
Ag Fe O Se,0.7832309272666665
Cr Fe O V,0.7831783648333331
Fe La O Se,0.7831696248666666
Fe Mo O Rb,0.7829645843333332
C K N Tl,0.7828035355666669
Cu Fe O Sb,0.7824840030999999
C Ca H N,0.7824614169333336
C I N Y,0.7824113018666667
Co Fe Ga O,0.7823922880333332
Cl Fe Mo O,0.7822912230000001
Fe Mn Na O,0.7822681092333328
Er Fe O V,0.7822359214666668
Fe O Sr V,0.7822202540666671
Fe Li Nb O,0.7822070906000005
Ba Fe Gd O,0.7820264670333336
As Ca Cr Fe,0.7820078803000005
Bi Fe Nb O,0.7819640656666668
Fe Li Mn O,0.7819465225000005
Fe H Mo O,0.781875174066667
As Cu Mg O,0.7818632706666665
Ce Fe O Se,0.7818278865333332
Fe K O Sn,0.7817983207000001
B H Mg N,0.7817524584000008
Ag Fe Mo O,0.7817328459333329
Bi Fe O Y,0.7816771479333334
Cs Fe O Rb,0.7816705227999999
Ga H Li N,0.7816086506000002
Ba Mg N Ta,0.7815880437333338
Cl H N Nb,0.781579626466666
Eu Fe O V,0.7815739908666667
C Cl H N,0.7815526511666668
Al C Cl N,0.7815361575333335
Au C K N,0.7815295979333334
C Hg K N,0.781365270266667
Fe O Se Te,0.7811485446666665
Fe Nd O Se,0.781087055333333
C Cl Hg N,0.7810169026000005
Fe K La O,0.7809650936999994
Cu N Na O,0.7807532202000005
C Fe V Y,0.7807508285333331
Fe Mo O Tl,0.7807344903333335
As Ca Co Fe,0.7807212149333332
Ca Co Fe O,0.780702702166667
Ga Li N Sr,0.7805589673000004
Cu Fe O Tb,0.780549742733333
Fe N O S,0.7804531398000004
Fe La O V,0.7804515733666668
C In Li N,0.7804193591666666
C N Ta V,0.7803522471000002
Ba Fe Ir O,0.7802719112000004
C Fe O Te,0.7802262775999996
Ag Cu N O,0.7801342090999999
C N Nb Ti,0.7801117875666663
Fe O V Zn,0.7799661966333334
B Fe Ga O,0.7799408220333335
Cr Fe O Y,0.7798749463666663
C La Li N,0.7797938000333333
Ba Co Fe O,0.7797644487000005
Bi C Fe O,0.7796705304866669
Fe O Sr Y,0.7796644725000005
Ce Fe O V,0.7796213038333328
B C Li N,0.7795790249333328
Cu Fe Ga Se,0.7795088758333335
Ba Fe O Ru,0.7794594593999997
Ba Ge Mg N,0.7794372850666661
Ca Fe O Rh,0.7794316573999995
H Mg N O,0.7793939343333333
As Fe O Tb,0.7793810631999999
C Cs Mn N,0.7793629978000001
Al Fe O Zn,0.7792928982333329
C Cs Cu N,0.7792606988666667
Fe Ga O Sc,0.7790393040666667
Fe Nb O Sr,0.7789137164666669
Cr Fe Li O,0.7788989710000002
Ge Mg N Sr,0.7788741794000009
As Co Fe V,0.7788044642999996
Ag Fe O V,0.7787725619666671
C Mn N Rb,0.7787588257000002
Cu Fe O P,0.7787470827666667
As Cr Fe Li,0.7787226368
Al Fe H O,0.7787172104333335
C H N Sn,0.7786935749000005
Ca Cu Ga O,0.7786661253333332
Ba Fe O U,0.7785142529999995
Cr Fe Ga Se,0.7784419882333335
C Fe Ga Y,0.7782575918333335
C Fe Mo Y,0.7781827204333337
C Cr K N,0.7781680587000002
Cu Fe K Se,0.7780985238333336
Cl Ga H N,0.777977182233333
Cl Ga N Se,0.7779546185333331
As Fe O P,0.7779250696666663
Al Fe La O,0.7779197293000001
H Hg Mg N,0.7779151301333338
Fe I Li O,0.7778908844666668
As C H N,0.7778280525666662
Br Fe O Sr,0.7777768343666664
Fe N O Ti,0.7777443923200004
Dy Fe Mo O,0.7776550059666669
Ca Fe O Re,0.7775247021333332
As Ca Fe Pd,0.7775218185333331
Ca Fe Ge O,0.7775202743333336
Fe Nd O V,0.7775062614
Mg N O Zr,0.7774224857666666
C Ca N O,0.777336296533333
Fe Li O Sn,0.7772936350333337
Fe H Na O,0.7772895044666668
Fe Nb Se Ta,0.7772526593000004
C Cs I N,0.7772182423666671
Ag C K N,0.7771486882666667
C I N Rb,0.7771235129333337
Fe Mo Nd O,0.7771049229666664
B C K N,0.7770662422333331
As F Fe Sr,0.7770411603999999
Ba Fe Ge O,0.7770312615333336
C Cd Cl N,0.7769348982333335
C K N Pt,0.7769051058000002
Br Fe H O,0.7768741786333329
Ba Fe O Re,0.7768490685
Fe Nb O Tl,0.7768286797000004
As Ba Co Fe,0.7767891791333329
Ba Ca Mo N,0.7767791105999999
Ba Fe O Si,0.7766778575666662
Er Fe O Y,0.776654571033333
Ba Fe O Tm,0.7766362070666661
C Cd K N,0.7765803594333334
Br C H N,0.7764942989999994
Ba Cu O Y,0.7764468173000002
Bi Fe Mn O,0.776364317933333
C Cs N Se,0.7763511158
Fe Li O Zn,0.7763483251666673
Cl Fe Mn O,0.7761918343666669
Br H N Nb,0.7761739954999998
Ca Fe O Os,0.7760735390799999
Fe Mg O Ti,0.7759821139333334
Cl H Mo N,0.7759114609666666
Fe O Se Sm,0.7758774537999997
Cl I N V,0.7757926660000005
Cr Fe Mn O,0.7757925723
Ca Cu O Y,0.7757688270999996
Ba Li N Na,0.7757669803666666
Cl Fe Li O,0.7757219724499995
C H Mn N,0.7757063960999998
C Cl La N,0.7756430971333333
Ca Fe O Si,0.7755964782999999
Fe La Li O,0.7755718891999998
C In N Na,0.775493157333333
Co Fe N Sm,0.7754728481000003
As Ba Fe Ru,0.775346656633333
Dy Fe O V,0.775266211033333
C Cu H N,0.7752155546999999
Ba C Cu O,0.7752120924333329
Fe Mn O Sr,0.7752045246333328
Ba Fe O Os,0.7751655849000005
C H N Rb,0.7751270161666667
Fe Ga O Pb,0.7750887513000002
C H N Sr,0.7750433637000006
C Cs H N,0.7750132191
Cr Cu Mg O,0.7749457441000002
B C N Na,0.7748684818666669
Ag C N Na,0.7748604002999994
C F Fe O,0.7747192051799997
Cu Fe Li Se,0.7745389376666667
Ce Co Fe N,0.7745374685666667
Al Cr Fe O,0.7745283359800003
F Fe Nb O,0.7744053670466665
Co Fe Mo O,0.7743965468000001
Cu H N O,0.774383636166667
Ca Cu O V,0.7743644423
Fe La Na O,0.7742493541466665
Ba Mg N Si,0.7742302885000005
B Fe K O,0.774106049666667
Ga H N Na,0.7740863431333334
C N Ta Zr,0.7740459278666679
B C N Y,0.773920068
Fe Na O Sn,0.7738936032466671
Cu Fe Na Se,0.7738318993333331
Al Er Fe O,0.7737568013666664
H I N Nb,0.7737266810000005
Ca Fe O Sb,0.7736647105
Cl N Nb P,0.7736477949000005
Al Eu Mg N,0.773621839366667
Cu Mg Mn O,0.7736095374333332
Fe Nd O Y,0.7734133489666666
C Ga N Si,0.7733171948333335
Fe Li O Te,0.7733114981533329
Ca Cu Li N,0.7732952741333339
B C Ca N,0.7732215996
Cr Fe O Rb,0.7731008667333341
Ba F Fe Se,0.7730675037666674
C Hf N Zr,0.7730317660999998
C H N Se,0.7729541260333334
Fe O Pr Se,0.7728383514333329
Cu Fe Ni O,0.7727880905999995
Al Bi Fe O,0.772783681433333
Bi Fe O Sr,0.7726941310333336
Er Fe Mn O,0.7726696405666661
Fe H O Sr,0.7726643194466664
Fe O Sm V,0.772655043433333
Fe Mn O Zn,0.7726408704000001
C Fe O Pb,0.7726296949333333
Cd Fe H O,0.7726270646833333
Al C Fe Mo,0.7726066550666669
Fe O Pb Se,0.7724743087000002
Ca N Nb Si,0.7724455609000006
Cl H N V,0.7723781262999994
C Cl Eu N,0.7722668221666672
Al Fe Nd O,0.7721585356333337
Ca Fe O W,0.7721563029000001
Ba Cu O V,0.7720725612999997
C H I N,0.7720057270000003
Cr Fe H O,0.7720012989333334
Co Fe N Nd,0.771961067333333
Fe Li Nd O,0.7719308439666664
Ba C N O,0.7719215990999997
Fe In O Y,0.7718736280999998
Al Eu Fe O,0.7718008345999999
Co Fe O V,0.7717898544333327
C Mo N Ni,0.7717210082000002
Fe K O Ta,0.7716830615333334
Cl Cs Fe Se,0.7716577234333332
As Ca Fe Pr,0.7715332956666672
Ba Fe O W,0.7715076540333333
C Hg N Rb,0.7714772683333337
H K Li N,0.7714098086999993
Br Fe O Te,0.7713827543666665
Fe O Pb V,0.7713488402666668
Fe H O Zr,0.7713389011666667
C Mn N Zn,0.7713198203333335
Fe Mg Ni O,0.7712025721666667
Au C N Rb,0.7711701490666666
C Cl N P,0.7711132037333328
Ba Cu Hg O,0.7710484037000004
Br Ca Cl N,0.7710358738666665
As Ba Fe P,0.771015837533333
C Li N Yb,0.7708702144000004
Ca Mg N Si,0.7708353324666665
Bi Fe O Zr,0.7708273134333333
Eu Fe H Mg,0.7708218051666668
H Li N Na,0.7707243058999991
Al Fe La Mg,0.7707071018000003
B Fe Mg Rh,0.7706997697000003
C Cl Co N,0.7706214210999999
Co Fe N Pr,0.770592154133333
Fe Na O Te,0.7705330506000001
Ba Mo N Sr,0.770508712233333
C H N Zn,0.7703445548000009
C Cl N Sb,0.7702103898666666
Cr Fe O Sr,0.770165423166666
H Li N Sn,0.7701540087333334
B Cu Mg O,0.7701193878000001
B Mg N Si,0.7700646752999998
Ba Fe O Sb,0.7699239590666667
H Mg N P,0.7698955356666665
Dy Fe O Y,0.7698908420000004
Fe La Mn O,0.7697701812999993
Al C H N,0.7696766532666667
B C Cs N,0.7695094372000002
B Fe N Nd,0.7694977905333333
C Fe O Ru,0.7694293019000003
Fe O Pr V,0.7694079705333333
Fe Ho Mo O,0.7692121497666667
Fe Rb Se Tl,0.7691715157999999
Eu Fe O Sr,0.7691293351533336
Ba Fe O Tb,0.7690629039666659
Fe O Sr Zr,0.7689964140666673
Cd Fe O Zn,0.7689659718999997
Ba Br Cl N,0.7689417855333338
Cu Fe Nb Te,0.7689315896000001
B C Cu N,0.7688946461999999
Fe H O Sn,0.768870295933333
C Hg N Se,0.7688084834000001
C K N Pd,0.7686684235000003
Cl Fe K Na,0.7686362788333331
Fe Ga O Tm,0.768538972333333
C Fe Ta V,0.7685064206666667
Cl Fe O Sr,0.7685016846666667
Fe O Sr Zn,0.7684835008000006
Br H Mo N,0.7683920328999999
C Cu K O,0.7683801936999998
Cr Fe O Zn,0.7680968688666664
Fe Ho O V,0.7680767129666675
Br Ga H N,0.7680625077000002
Cu Ga O V,0.7680001474666669
C Co K N,0.7678896079333335
Cl H N Zr,0.7678484790000005
B C N Rb,0.767846450533333
Cl Fe H O,0.7678144722666669
Cd Fe La O,0.7677727661
Cu Li N Sr,0.7677585861666668
Er Fe N Ti,0.767720666933333
Fe Nb O Ta,0.767720404366667
Fe Mn Nd O,0.7676824351333333
Al Fe O Sm,0.7676499802999998
Al Ca Li N,0.7676306196999999
Fe O Sr Tl,0.7673788040999998
Co Fe O Y,0.7673589651
Fe Li O Sm,0.7673222517000007
C Cr Fe Mo,0.7673201487666668
Cr Fe La O,0.7672767847333336
C N Ti V,0.7672750799333333
Ca Cu La O,0.7672585152666667
As Ga Mn N,0.7671792849333341
Fe H O Te,0.7671640381666661
Ca H Li N,0.7671613790333331
Ba Cu La O,0.7670412340000002
Fe Nb S Se,0.7669787064666659
Al N Nb Ti,0.7668345212000005
Fe Nb O Pb,0.7667599498333332
Fe O Sn Sr,0.7667447401000002
Fe La O Sr,0.7667438066133334
Cu Fe Se Sn,0.7667184975333334
Fe In Mn O,0.7666699921666669
C N Pt Rb,0.7665999558000001
As C Cr N,0.7665241970666667
C K N O,0.7665082712000004
As Ca Cu O,0.7664651651666672
C Fe Ge O,0.7664483796333336
Bi Fe La O,0.7663926360333333
Au C H N,0.7663804092666663
Fe O Si V,0.7662067357000004
C H Hg N,0.7661841303666661
Cl H N Na,0.7661421645666671
Fe Gd O V,0.7660357967666667
C Fe O Re,0.7660323386333333
As Fe O Ti,0.7660273192666668
C N Tl Zn,0.7659838098333331
C Fe O Os,0.7659721824833333
F H Mg N,0.7659676024666671
Cu Fe O Ti,0.7659482486999994
Cl Mo N P,0.7659283765666659
F Fe H O,0.7658506543000004
Fe Mo S Sn,0.7658377284000001
Ca Li Mn N,0.7656638292333331
Ca Mo N O,0.7656595609666668
Fe O Sc Y,0.7654749888333336
Co Fe Li O,0.7653216375000004
Cu Li Mg O,0.7652757100666662
Br H Li N,0.7652477842333334
Fe H V Zr,0.7652059894666666
C Fe O Si,0.7651668706666666
Fe O Sr Te,0.7651386986833331
Ca Fe O P,0.7650008130999999
Au C N Zn,0.7649913780333337
F Fe Na V,0.7647302800666663
B Fe Li O,0.7646713310000001
Ba Fe O P,0.7645370905666663
Cl Ga N P,0.7644468862000005
Fe Nd O Sr,0.7643343245999998
Ca Cl N Sr,0.7643309979333329
Ca Cu O Sr,0.7643257327
H K N Zr,0.7642924141666666
As Br Fe Hg,0.7642748875666662
Co Fe Na O,0.7642445983333335
Fe H V Y,0.7641832854999998
Fe N Nd Sm,0.7641126250333335
C Cr H N,0.7640710207333334
Dy Fe Mn O,0.7640550597333329
Ba Ga N O,0.764040162666667
Au C N Tl,0.7639979523
Cl Hf N Na,0.7639718918
C H In N,0.7638951751000004
Fe Mn O Ta,0.7638550719666666
B C Fe Mo,0.7638449387000001
Dy Fe Ga Se,0.7638274603666664
Cl Fe O Te,0.7636472431000004
Br Cl N Sr,0.7636044538666659
Al H Li N,0.7635897276333338
C Cu O Sr,0.7635586896000001
C Dy Fe Nb,0.7635465022000003
Ce Fe O Sr,0.7634913167333336
Cl H N Sn,0.763316994566667
Al Be Fe O,0.7632853662666671
C H N Pt,0.7632096942999993
H K N Sn,0.763189459466667
Al Fe Mg Si,0.7631400310666667
C Hg N O,0.7631115439333332
B Fe Nb Y,0.7631096372000002
H K N Na,0.7629728379666663
C N O Y,0.7629060347333332
As H Li N,0.7628887813333337
Cr Fe O Te,0.7628801511333337
C K N Ni,0.7628598711000006
Ca Fe O S,0.7628470453666668
Al Fe Lu O,0.7628398802333336
Fe Ga O Tb,0.7628383668666672
Bi Fe O Te,0.7628057686666666
Al As Fe La,0.7627637608666666
C N Si Y,0.7627153090000004
Eu Mg N Ta,0.7626292729333333
Mg N Si Sr,0.7625959029666664
C Fe O Sb,0.7625440933333327
Dy Fe N Ti,0.7625298660333332
F Fe O Sr,0.7624535709833341
Fe Ge K O,0.762416400533333
Mg N O Ta,0.7623752048000004
Ca Cl H N,0.7622373371333336
Fe Ga Nd Se,0.7622281596333332
C Cd H N,0.7622219126333329
Fe N Sm Ti,0.7621933839000005
Ca N Nb O,0.7621612836
Ba N Nb O,0.7621324878999999
Bi Fe Nd O,0.7621169232333331
Al Fe Mg Nd,0.7620795870000001
Ba C Co N,0.7619939193666667
Ag Fe La O,0.7619750746000004
B C H N,0.761971986633334
Ca Cu Nd O,0.7619258793000001
Ag C H N,0.7619170987999999
H Li N Rb,0.7619164746666672
Bi Cr Fe O,0.7618193710000001
C Cu Na O,0.7618174865333334
Al N Nb O,0.7617438674000003
Br H N V,0.761727314
C Li N O,0.7616994321999996
B Fe Ir Mg,0.7616902293333335
B Fe Mn O,0.7616418211666665
Ba Fe O S,0.7616300077333332
Cl Mo N S,0.761570987
Fe K S Se,0.7615605981666659
Ba Mo N O,0.7615467628999999
Cl Cu H N,0.7614731720333335
Fe Mn O Sm,0.761466810966667
Cr Fe Nd O,0.7614257909666664
C Fe Ga La,0.7614041072200001
Cs H Li N,0.7613260979666666
Ba Cu O Sr,0.7612786826666669
Fe Gd O Y,0.7612543420333333
H I Li N,0.7611917229666663
Fe H Mo Zr,0.7611712402333327
Fe K O Si,0.7611337539666665
B C N Zn,0.7611066694666667
Al Ba Cu O,0.7611045682333336
C Fe Sm V,0.7609827951999998
Al Fe Mg Pr,0.7609656319666663
H Li N Sr,0.7608043620666669
Al Cu Fe Se,0.7607064151000005
Dy Fe O Sr,0.7606289260000001
C H N Si,0.7606122632666664
Ga H I N,0.7605742968333331
C Fe Nb S,0.7605370324666668
Co Fe Mn O,0.7604760846666666
B C N Tl,0.7604740888999998
Cs F Fe V,0.7604703238866666
Ba Cu Nd O,0.7603560032666665
Fe La O Te,0.7601853139000002
Fe Mn O Pb,0.760149677066667
Ba H K N,0.7599982693999999
Al B C N,0.759995387
Bi Eu Fe O,0.7599479808666665
Al Ce Fe Mg,0.7598784000666661
Fe Ga O P,0.7598353899666667
Ag C N Zn,0.7598050603999996
Ba C N Rh,0.7597463172000002
H I N V,0.7596990724000001
Cl Li N Ti,0.7596602760666673
C N Pt Zn,0.7596533661666665
C Fe Nd V,0.7596107458
Cl H Mn N,0.759588657566667
B Fe H O,0.7595640157166671
Br Ca Cu O,0.7594834574000001
Fe Li O Ru,0.7594828437666664
Fe H Mo Y,0.7592573098666664
Fe Li O Rh,0.7592534780666671
B Br Fe O,0.7592506600999999
Cu Fe Se Tl,0.7592186018333333
C Cd N Zn,0.759208901133333
Al Co Fe O,0.7591628349000001
Ag C N Tl,0.7590151112333334
Fe O Sr Ta,0.7588654177333335
Fe N Nd Ti,0.7587755832666667
Cl N Sb V,0.7586704529333334
Fe In O Zn,0.7585663534333337
Fe N P S,0.7585548185999996
F Fe O Te,0.7585192041999999
C Fe Mo Sm,0.7584699418333336
Fe La Se Sn,0.7584344906999999
C N Pt Tl,0.7583645468000005
B C Hg N,0.7583172716999997
Fe Ge O Y,0.7579901208333332
Cr Fe Se Zn,0.7579878655
B Fe I O,0.7579430106666661
C Eu I N,0.7579045512666666
C N Ti Zr,0.7578370215000004
Fe Ir Li O,0.7578284846333339
Al Li N Sr,0.757824435733333
Al Fe O Si,0.7577981587800005
C Fe O P,0.7575579122366676
Ba Fe Ni O,0.7575341093000002
Fe K P Se,0.7575193817666666
Fe Ge K Se,0.7574126896666666
Ba Cu Mn O,0.7573623387333337
Ba Cu O Zn,0.757242446233333
Al Fe O Tm,0.7572307696333334
Ca Cu Mn O,0.757229947666667
Ba Ca N Na,0.757221047533333
C Li N S,0.7571920960000004
Ba Cu Na O,0.7571332473999998
Fe Mn O Yb,0.7571091712999999
C Cu O Tl,0.7571015161666667
As Ba Cu O,0.7570966427999998
Cs Fe Ga S,0.7570357089
C Co Cu N,0.7570196115333336
Li Mn N Sr,0.7570045140333337
Mo N O Y,0.7569841185999999
Ba Cu Nb O,0.7569752671999999
C Er I N,0.7569641457333335
C Co Mn N,0.7569179274000001
Fe Lu Mn O,0.7568842636333337
B C Fe Y,0.7568451137333327
C Mn N Ru,0.7567917995333334
Co Fe O Sr,0.7567534411
C H N P,0.7567113994333333
Bi Fe O Sm,0.7567108964333331
C Fe Mo Nd,0.7565830057333333
Cs Fe O Si,0.7565668830666668
Al C Fe Y,0.7565287677666667
Ca H K N,0.756475281833333
Fe O Sm Sr,0.7563796620666667
Fe Na O Ru,0.7563674071533332
H N Na Sn,0.7563102833000002
C Hf N Ta,0.7563001973333328
C H N Sb,0.7562958451
Fe O Sb V,0.7562477874466663
Cl H N Sr,0.7562028752000003
Cl N Nb S,0.7561846479000002
C N U Zr,0.7561523880333331
Fe N Ni Sm,0.7560825657666663
C Er Fe Ga,0.7560541999666669
Ba Cu Er O,0.7560098059666668
Ga Mg Mo O,0.7559937783666665
Al H K N,0.7559431847000003
C Cu F N,0.7558908075666665
Bi F Fe O,0.7558875745333333
B Fe O Zn,0.7557624602000003
H Li N Zn,0.7557614805333336
Ba Fe Se U,0.7557560059000002
Fe Li S V,0.7557476990666662
Fe Ho N Ti,0.7557356464333329
Cl Fe Li Zr,0.7557292377333331
C Cu H O,0.7557027943333335
Al Cl H N,0.7556894141
Fe Ir Na O,0.7556709288666666
Fe Gd N Ti,0.7556549646666665
Ba C Ir N,0.7556468455333335
Fe Li O Si,0.7555674940666676
C Ca Mg O,0.7555476000000002
C Co N Sr,0.7555109623333333
Fe O Pr Sr,0.7554593785333332
C Cl N S,0.7554462141999992
Fe Ho Mn O,0.7554053970000003
C Fe Mo Pr,0.7552288923333336
H K N Y,0.7552213148666674
Fe O Tb V,0.7551712958666668
C H N W,0.7551667199666671
Eu Mg N Si,0.7551650491333338
Fe Hf O Sr,0.7551478548333335
Fe O Pb Sr,0.7550308624666665
Fe Ge Li O,0.7550151708666666
