C Cl Cs Tb,0.5902541446666667
Cd H Nb O,0.5902419441666669
Ba Mn O Sn,0.5902297566000001
Ba Mn Nd O,0.5902263535666666
F H Mg Na,0.5902191498866666
Br C Rb Tb,0.5902124052000002
Cu Ho O Ti,0.5901916861333334
Cl Mo O Tl,0.5900194954000002
Cr Cs O V,0.5899124899333332
Al Bi Ga O,0.5898971659333339
Na O Te V,0.5898459327433332
Al Ba O Sr,0.5896689570333331
Nb Nd O Sr,0.5896423466333336
Mo O Sb Y,0.5896170796399999
Bi O V Zn,0.5895690497000003
Br Cs Mo Se,0.5895513197000004
Co Dy Fe Ti,0.589478811266667
C H O Sb,0.5894761612799997
Ga Nd O Sr,0.5894483195266668
Li O Y Zr,0.5894153479466666
Bi Mo Pb S,0.5892748235333336
Al B Ca O,0.5891449004166662
O Te V Zn,0.5891385799166668
Bi C H Si,0.5891194563666668
Ga Ho Mn O,0.5890473143333328
C Cl O Pd,0.5890263734333333
Cs O Sr V,0.5889934349999999
Mo O W Zr,0.5889765152666665
H Mo O P,0.5889337774866663
B Ca O Y,0.5888968398466667
Ba Co O V,0.5888836502000001
In Li O V,0.5888436194633333
Cu Dy O Ti,0.5888432952333336
Br O Sr V,0.5888162107333337
Nd O Se V,0.5887185939499998
Nd O Sr V,0.5886316075333333
Ge Mn V Zr,0.5886070428666662
Er Fe Sm Ti,0.5885968475999998
Nb O Sr Zn,0.5885957306133336
C Mn O S,0.5885485745200001
Cs Ga O Se,0.5884986958133338
Ga La O Sr,0.5884800573333331
Ca La O Zr,0.5883775222966668
Ba H O Zn,0.5883761078000002
Cu Nb Se Tl,0.5883620118499998
Ge Li Mg Sr,0.5883331791200004
Nb P S V,0.588265178933333
Al C Mn W,0.588257057
Bi Ce Mo O,0.5882253539333336
Al Ca O Pr,0.5881835231499997
La O Sr V,0.5881666878866669
Cl Eu Mo O,0.5881256004333333
Cu Lu O Ti,0.5880564637666665
Cs O Se V,0.5880205116200001
Cr Ga O Sr,0.5879917608333335
C O P Sn,0.5879639311300003
B O V Zn,0.5879341812166667
Ga Li O Te,0.5878841476833334
O Rb U V,0.5878819239666663
Al Ca O Sm,0.5878629604666664
C Co O Se,0.5878504174633332
Mo O P Rb,0.5878336674933334
K Nb O U,0.5878105339166665
Cl Lu Mo O,0.5877826889133332
Bi La O V,0.5877756231666669
K O Th V,0.5877747147533334
Ga H O Te,0.5877498848333335
Br Nb O Tl,0.5876414703366667
O Pb Si V,0.5876062169666665
B Ca H O,0.5873607093266667
Ba La Mn O,0.5873283132666661
Ba K O U,0.5872944874000002
Ba Li Mn O,0.5872881066666666
Co Fe Si Tb,0.5872089486333336
Cs La Nb O,0.5871993781899997
Fe Ge Sb Ti,0.5871595246333333
H Hf V Zr,0.5871516864333332
Bi Ca Mn O,0.5871414639200002
Ba K Se V,0.5870965248666667
Ba Nb O W,0.5870590456333337
Cd I O V,0.5870498264833333
Hf Mo O Pr,0.5870191551333332
Ca Co Nb O,0.5870057432
Ge Na O V,0.5869562004866666
Ce K Nb O,0.5868942699000004
Na Nb O Te,0.5868936449033337
Cd Mo O Tm,0.58687438785
In Nb Nd O,0.5868018940666668
Au C H S,0.5867964320666668
F Mg O P,0.5867897530000001
Cd Li Mg P,0.5867217504499997
Ba Er O Zr,0.5867179789333338
Ga La O Se,0.5867179431333335
Cu Nb Se Te,0.5866795643999999
Be O Si V,0.5866476902533332
Ag Cs Mo S,0.5866424110333334
Ba O Sr Y,0.5866094512666665
C Co O Sn,0.5865193954933337
Al C Si Zr,0.5864977927866672
Ag Mo O Te,0.5864581690866665
C Na Np O,0.586318598693333
C Cl Gd Rb,0.5863085458666668
In K Mg Rb,0.5862385944366667
Li Nb O Zn,0.586190817046667
Li Mg Pd Sn,0.5861175312666664
Ba K O Ta,0.5860999773000001
Al C Ge Zr,0.5860735232333332
Ba Ca O P,0.5860530779333332
Bi Na Nb O,0.5858243544333332
K Nb O Pb,0.5857509979333333
C Cl O Pb,0.5856903285599996
Mo Na O P,0.58567957928
Nb O Rb U,0.5855869737199998
Ba Mn Na O,0.5855156209000006
C F Li O,0.5854149652000005
Mg Mn Ni O,0.5854113971666667
Cs Mo O S,0.5853998526333335
B Cs Ga O,0.585351003193333
La Mo O Re,0.5852709236333338
Nb O Pr Rb,0.5851932342799998
Eu H O V,0.5851478591999997
C O Ru Te,0.5850607602000001
Bi Mo O Yb,0.5850435419833334
Cl Mo O Te,0.5850225935900003
Ca Mn Na O,0.5849945594666671
K Nb P Se,0.5849940634200004
Ca Cr H O,0.5849493451799997
C Ge H Si,0.5849434841666662
H K Mn O,0.5849159770233333
B C Sc Si,0.5849064394999997
Mg O Ti Zn,0.5848457653066668
Bi Li Mg Pb,0.5847959823333333
As Nb Te Tl,0.5847592559333331
Ba Cd H O,0.5846025225666667
Al C Ce H,0.5845976857666669
Bi C O W,0.5845660780066667
C F H O,0.5844765623133332
Ba Br H O,0.5843354873000006
B Ir Mg Ti,0.5843020413333335
F K Mo O,0.5842789203100001
O Ta V Zn,0.584274715066667
B Br C Gd,0.5842584898333332
Ca Mn Nd O,0.5842533856566666
Cl H O V,0.5842285035666663
C In O Re,0.5841792881333331
Ag As O V,0.5841235158466673
Ag Mo O Sm,0.5841111001999999
Mo Na O Tb,0.5841073932466669
Ag H O V,0.5840265686333336
K Nb O Ta,0.5840133906633336
Cl Ho Mo O,0.5839407890000002
C Cs I Pr,0.5839068735333328
Ba O Pr Y,0.5839010536666664
Ba Cr H O,0.5838803904333332
C O Pt Ru,0.5838785135000002
O Te Tl V,0.5837952737999993
Li O Te V,0.5835416318566664
Na Nb O Sc,0.5835113695799998
Cr O Sr V,0.5834674209866664
I Nb Se Te,0.5834141646999997
Cl Mo O Pr,0.5834083787133331
C O Pt Re,0.5833338854666668
Ga K O P,0.5833155531533333
B Li O V,0.5832644175666669
Cd O Se V,0.5832261909666673
Al As K O,0.5832092678999997
O Se Sr V,0.5831303704000003
Cl Dy Mo O,0.5830978188500001
F K Mg Na,0.5830335638333334
C Co O Sr,0.58302482925
Cl Mo O Sm,0.5829956268799997
Cr La Nb O,0.5829808889733336
B Mn Nb Ru,0.5829370683000001
Cd O Sr V,0.5828256409666664
B Br C Ce,0.5827904187333336
Al F Mg Na,0.582730594986667
Co Fe Si Tm,0.5827020315
Cu K Nb S,0.5826634245666666
Ca Mo O Ti,0.5826444427499997
Ge Na Nb O,0.5825410836866667
Na O U V,0.58251812228
H O U V,0.5824992849533338
In O Se V,0.5824936238999998
Ba K O Si,0.5824557358333337
Cl La O V,0.5822763348300002
C La O Sb,0.582222834746667
Dy H O V,0.5821366151466666
Ca K O Pr,0.5820995962999995
Cl Gd Mo O,0.5820166931300004
Cl Gd K Nb,0.5820139005299999
C H Np O,0.5819645145
Ge Nb O Rb,0.5819419844466668
Dy Hf Mo O,0.5818794168900004
Ce Fe Ni Sm,0.5818772369666664
B Ca Mn O,0.5818604092566662
Co Fe Ge Ti,0.5818397535999996
O Sn Y Zr,0.5817514886500006
Ba Nd O Sn,0.5817170051666668
Cu Gd O Ti,0.5816765828999999
Cd Mo O Th,0.581630665783333
Ca H O Zn,0.581577875966667
C H O S,0.5815501280666667
Mo S Se Sm,0.5815325027000001
La Mo O Tb,0.5815283417000002
Ba Er Mn O,0.5814855272333334
Ge Li O V,0.5814286671500003
O Ta Tl V,0.5813693881133327
B Ga Nd O,0.5813632470933334
Ag As Nb O,0.5813558965533335
Ba H O Tl,0.5813224835333332
Cl Mo O Pb,0.5812959473333339
Ba Ca O W,0.5811854988600006
Bi Cr Ga O,0.5811779163666665
In Mo Na Se,0.5811591604
Cs Nb O Se,0.5811401440533331
Co Dy Fe Tb,0.5811113153199996
Nb Ru Si Zr,0.5810914191333334
Mo Rb S Sc,0.5810793056333332
Ca K O U,0.5810641064200004
C Cl O Rh,0.5810493461666669
Al Ga Lu O,0.5810193029933329
Na O Pb V,0.5810103170333333
Bi Cd O V,0.5809301971666669
Cd In O V,0.58079688045
Co H Mo O,0.5807954932199997
Hf O Sr V,0.5807586886300002
As F K Mg,0.5806990462266667
Cl F K Nb,0.5806433789066667
Bi Nb O Zn,0.5805131916666671
Mg O Ti Tl,0.5805046862466668
B Ba O Y,0.5805001883366668
Na Nb O U,0.5804961697133335
As Ga K Li,0.5803995550333334
Ba Co Nb O,0.580385164733333
C I Pr Rb,0.5803271363333337
In La Nb O,0.5802413471366665
Cs Nb O Si,0.5802044538500002
Ba O Pt Y,0.5801404220999997
Ba Ge K O,0.5801245063000003
Co La Mo O,0.5801093772000002
Ba O Ta Y,0.580076380453333
Ag Mo O U,0.5800319577666664
Al Ca Cl O,0.5800244808833338
Cs O Ta V,0.5799019681833332
Cl K Lu Nb,0.5799017748866666
Na Nb O Ta,0.5798709742966669
Ga Mn O Tm,0.5798307862133331
Ba Mn O Zn,0.5798229440333332
C Cl F Se,0.5798192809866668
Ba Mn O Se,0.5797813116000001
Li Mo O P,0.5797808102866663
Ba H I O,0.5797160621666667
Bi Ca Na O,0.5796902588799999
Cs Ge O V,0.5795614357000002
C Cr Cu Ta,0.5795523773666666
Cu Nb Se Ta,0.5794558548333335
Nb Nd O Sc,0.5794119355166667
Al Ba O Rh,0.5794085743833334
Al Ba O Sc,0.5793678025666664
Ca O Sr Zr,0.5791510516200001
Ga O Rb Si,0.5791009792366666
Ba O Y Yb,0.5790366603666663
Ca F O V,0.5790289677299998
Mg O Sm Ti,0.5789963171833338
Ga Na O Te,0.5789934641
B C F O,0.5789898058266673
K Mo O Sb,0.5789698090666668
Al Cr Hf V,0.5788785643
Cs O Te V,0.5788512562866669
Cu Ni O P,0.5788471388400005
Ca La Mn O,0.5788309344200001
Bi O Sr V,0.5787927328666665
La Li Nb O,0.5786896391066667
Ge Hf Mo O,0.5786683936333334
Ba La O Sn,0.5786609660500003
Al Ca O Pb,0.5785945154999999
C Li O Ti,0.5785798214666663
Ba Bi H O,0.5785296367999994
C Hf Ta Zr,0.5784917879333334
Ga In O Zn,0.5784880928666664
Mn O P V,0.5784089636666667
Cl I Mo Na,0.5783477496000002
Ba Hg O Pt,0.5782351376333337
Ca F Nb O,0.5781639132333335
Au C Cl S,0.5781639040299996
Ca H O Se,0.5780894274200005
Al Ba In O,0.5780553375799998
Br Mo O Tb,0.5780379040999999
Al Nb O Ti,0.5779945278000004
H Nb O Pb,0.577991382916667
Cl H Nb O,0.5779801196933331
Cs Nb O Sr,0.5779476080166663
Al H O Rb,0.5779371166333338
Cl Na Nb O,0.5779152967333332
I Mo Se Te,0.5778954391333341
H O Pb V,0.5778953901999998
Mo O Sr Tb,0.5778649135866668
B Ca O Sn,0.5778502581699999
Hf Mo O S,0.5778404834666665
Ba Cr Mn O,0.5778132952200001
Li O U V,0.5777855744500003
Ca K O Si,0.5777802978333334
I Nb O Te,0.5777523945099999
La Nb O Sr,0.5776841811633333
Ag Na Nb O,0.5776826121800006
Li Nb O Sr,0.5776388854
C Cl O Tc,0.5776057258800003
Ba H O Se,0.5775893868500003
Ce Cl Mo O,0.5775854857866667
Bi In O V,0.5775781643166664
C Co O Tl,0.5775735748333329
O Sr Ta V,0.5775714885666671
Ca K O Ta,0.5774253889233338
B Ge Ir Mg,0.5774089884000001
C Cl O Ru,0.5774067975266662
Co Fe Ho Ti,0.5773887793666668
Ca Mn O Zn,0.5773860621700004
Cu O Ta Ti,0.5773699404
Cu F K Mg,0.5773516958766662
Nb O Ta Zn,0.5772774788199999
C O Os Pt,0.5772397142666666
Bi O Se V,0.5770922906333333
O Pb V Zn,0.5770559332166669
Cl Nb O Rb,0.5770551322999999
Ca Er Mn O,0.5770304639833337
Al K Li O,0.5769945718
I O Pr V,0.5769283994500002
B Nb O Rb,0.5769007663000002
Cs Cu Mo Se,0.5768971471466663
Ag O Tl V,0.5768550701633337
Ba Bi O Zr,0.5768535979
Ga Nd O Sc,0.57684925235
In Mo Rb Se,0.5768468679666667
Cl Nb P Se,0.5766379599200003
Eu I O V,0.5766254468999996
Br Nb O Te,0.5766025512066668
Ga La O Ta,0.57655827575
Ca H I O,0.5764833095333337
Ba Nd O Zn,0.5764757555333335
Bi Br Nb O,0.576455493966667
Cs Ga O Te,0.5764233144333332
O Sc Se V,0.5763823708133339
Ga O Te Zn,0.5762344881233336
I O Sm V,0.5762011861000002
O Se Sm V,0.5761938902633332
K Mo Np O,0.5761669597666669
Ba F O V,0.5760475765333334
Fe Ni Si Sm,0.5760012238833334
Ag I O V,0.5759937687000002
Mo O Rb Sb,0.5759778787833334
Co Fe Gd Ti,0.575866023383333
O Sr Te V,0.5758615433100003
Al Ca O Si,0.5756585667366663
O Pr Sr V,0.5755620844133335
Fe Ni P Si,0.5754383172333333
Ga K O W,0.5754374893333334
B Ga O Sr,0.5754027299666666
Ga Ge Mn O,0.5753825380866665
Ba F Nb O,0.5753212587166667
Ge La Nb O,0.5753087044000001
Li Mg Si Sr,0.5752893403999999
Mo O Te Th,0.5752600766200003
Nb O Pb Zn,0.5751084644000001
Li Mg P S,0.5750130790733332
La Mo O W,0.5750111469199995
Al Ba Dy O,0.57497631852
C Cl O Re,0.5748806828099995
B C La Pt,0.5748747245333327
Na Nb P Sr,0.5748134467999999
Bi Cs Nb O,0.5747738153166665
Nb O Te Tl,0.5747558270166674
C Cl Ir O,0.5747345567599995
C O Te W,0.5747298445266668
C Cs F O,0.5746449606033334
F La Mo O,0.5745776267333331
Ba H In O,0.5745759001666674
Cs Mo O P,0.5745517761333327
Li Nb O Te,0.5745426300000002
C Cl F I,0.5744765841200001
B Ba H O,0.5742983225866667
Fe Ni Sb Ti,0.574267540866666
Al B Ba O,0.57426712373
Dy Fe Nd Ti,0.5742488822199996
H K O Sn,0.5742156751666667
Nb O Tl U,0.5742071398000003
Al Ga Gd O,0.5741604375833331
Ba F Mg Mn,0.5741578265166668
Gd Ge Mo O,0.5741122708799996
Cu S Sn V,0.574111251466667
Ga Ge O Rb,0.5740927709666667
Cu Na Nb S,0.5740689570799995
La Nb O Te,0.5740423318333338
C Na O S,0.5740082318666664
Ga In O Sn,0.5739932121599997
H O V Yb,0.5738378654000001
In O Te V,0.5737896821566666
Cs Nb O Te,0.5737206074933332
Mo O P Sr,0.5737197812633339
Nb O Si Sr,0.5736941381733331
Cl Mo O S,0.5735637680333334
C Cl O Os,0.5735293104799997
Ce Fe Ge Ni,0.5735219848333333
Cl O Sr V,0.5734498132866668
Al Nd O Y,0.5733826003600003
O P Si V,0.5733666548066668
Nd O Y Zr,0.5733490168500003
Cr Nb O Sr,0.5733135692000001
Br C Cl Ti,0.5732396504333336
Cl Mo O Yb,0.5731686393133337
Bi C Co O,0.5731362296466668
Cd O Te V,0.573108170253333
Ag O Se V,0.5730861314866669
Cr F Nb Zr,0.5730791189133335
Ba In O Zr,0.5730590409333332
Cl Mo O Tm,0.5730131098000001
O P Sn V,0.5729835041266665
Co Li Mo O,0.5729724892833332
Al Cs F Mg,0.5728175808466662
Ag Mo O Yb,0.5727915766833335
Ba F Ga O,0.5727555898200003
Cd Mo O P,0.57270551378
C F La O,0.5726703614000003
Ce I O V,0.5726605536333331
B Ca Na O,0.5726436479833334
Ag La Nb O,0.5726242141166668
Ba O Pr Zr,0.5726135183000001
Eu O Se V,0.5725276197800006
F Mo O Rb,0.5725263776066667
Ag Cd O V,0.5724753583333335
Ag O Sr V,0.5724621779966665
Cs O U V,0.5724605603500001
In Nb O Sr,0.5724386023599999
Ga Ge H O,0.5724195451
C Er Ru Y,0.5723082582333331
H O Th V,0.572307744833333
Ag Cs Nb Se,0.5722661816333333
Ga Nd O Sm,0.5721492060999995
Ba Cr O Sn,0.5721435582466666
Br Mo Se Te,0.5721168098666666
Bi Ge O V,0.5720635178333336
La O U V,0.5720537554833327
Al Au V Yb,0.5720412113466665
Mo Nd O Sb,0.5720301423333334
H I Nb S,0.5720156854533333
Cl La Nb O,0.5719610493199995
C F H Si,0.5719300756933333
Mo O W Zn,0.5719195268000004
Ba Mn O Sr,0.5718306692
As Ba O Zn,0.5718071605833335
B Mo O Pr,0.5718013774766667
Li Mo Ru Se,0.5717850013333334
Ga La O Sm,0.5717791078900001
Ba Ir K O,0.5716506991999996
C Cl O P,0.5715309066566664
La O Y Zr,0.5714570320300009
Lu O Sr V,0.5713494493633332
K O P V,0.5712843405666667
Ba La O Zn,0.5712624966333331
Ag Nb Rb Se,0.5712543605666668
F Mo Nd O,0.5712529475166671
Ga La O Pr,0.5712183681666666
Ba Rb Se V,0.5711998717000004
O P Rb V,0.5711768123666663
Cd Cl O V,0.5711610540666667
Mo O P Tl,0.5709858298499998
As K O Zr,0.5709590079833337
F Nb O Sn,0.5709482377433333
Bi Li Nb O,0.5707860292399998
Cs Li Nb S,0.5707786450200001
Co Mo O Zn,0.5707376698333337
H Mo O Pu,0.5706686444666665
Bi Br Ca O,0.5705829176066665
Ga In O Sr,0.5705676153133334
Be Ca Nd O,0.5705644581866668
Ba Ce O Y,0.5705644048400003
Ca H O Si,0.5705245555833337
B Cs Nb O,0.5704488250500003
Nb O Sc Sr,0.5704376813833335
Bi In Nb O,0.5704293467833336
K O V W,0.5704226731766667
Nb O Se Sm,0.5703974411333331
Ba K Nb S,0.5703741758833335
B Ba O Zr,0.5703519728233337
Cu Nb Ta Te,0.5703001718833333
Ca Cr Nd O,0.5702650970499996
Ga La Lu O,0.5702501065633332
Bi O Pr V,0.5702027296999997
B Mo O Pb,0.5701890462733332
Ga Li O Si,0.57016353936
C F O Sr,0.5701619308633328
O Pb Se V,0.5701375235466665
Co Mo Na O,0.5700897499499998
Fe Ni Si U,0.5700754693333329
As Ba Cd O,0.57006321102
Mo O Sr W,0.5699901897466664
Cl Cs Nb O,0.5699383438099997
I Nb Ta Te,0.5699173342333332
Gd O Se V,0.5698948812366663
Ga Ge Li O,0.5698886733033335
Br Cl Cs Mo,0.5698316559333332
Bi Nb O Sr,0.5694469014466664
Hg O P V,0.5694206587366668
B Nb O Tl,0.5693951902200002
Ca La O Sn,0.5693250643466663
In Nb O Te,0.5693082020133329
Li Nb Rb S,0.569268839333333
Ca Mn O Sr,0.5692311618366666
Au F H Mg,0.569086268386667
Nb O Pb Se,0.5690711081666666
B C Er Si,0.5690398497000002
Ba H O Te,0.5689832919333334
Bi Er Nb O,0.5689704450599998
Cl Cs Nb S,0.5689606871999999
Cu Mg S Sn,0.5689553283199997
Cl F Na Nb,0.5689448575766666
K Mg P Se,0.5688142147866666
Bi O Sm V,0.5687533434199995
Ba Mo Ni O,0.5687466892100003
Li Nb O U,0.5687453220700002
Bi Cr Nb O,0.5687339576000001
Co Cs Mo O,0.5686223607666666
Al Mo O Ti,0.5685864440333337
Ba Bi Mn O,0.5685495873
Cu O S Sb,0.5685314655166671
Mo Na O Pu,0.5684891304000004
As Bi Ca O,0.5684719847166667
Al Cr O Y,0.5684349095166671
Nb O Sm Sr,0.5684323692666665
Ba O Sc Zr,0.5684318525666666
Ca Cr La O,0.568384351256667
Cs Nb P Se,0.5683471392333335
Al Au Ca Mo,0.5682968370666669
Ce O Sr V,0.5682173322000007
Nb O Pb Tl,0.5681763350166665
Ba Ho O Zr,0.5679509815666667
Au Ba Na O,0.5679406042333331
O Sr Tm V,0.5679106675333336
Bi C La Mn,0.5679067668999996
Ag Cl Mo Se,0.5678971290466663
Ba Cl Hg O,0.5678930852666666
K Mn O Sn,0.567815241766667
Al Ge Mg Y,0.5677354440733337
Ba Ca Co O,0.5677087759666671
Ba H O Ta,0.5676283604666664
Bi Ca I O,0.567619080326667
Cu Nb Rb S,0.5674332261333325
C Cl Gd I,0.5673398166000002
Ba In Mn O,0.5672805269
Co H Mg Y,0.5672457449333332
Ce La Nb O,0.5672333375933332
Nb P Rb Se,0.5672231322666665
Cl Nb O Tl,0.5671257901133335
O Pb Sr V,0.5671195129999994
Br Nb O Pb,0.567065159666666
C Co In O,0.5670548611433333
C Cl Co O,0.5670437750966665
Ba Mn O Te,0.5670047455000001
Ge Li Nb O,0.5669585216299997
Ba Dy O Zr,0.5668597644000004
Ba Cs Se V,0.5668249410666673
I O Pb V,0.5667964006999999
Bi Eu O V,0.5667861121333333
C F O Tl,0.5666298059566663
Ca O Ta Zr,0.5666131747166666
Ca I Na O,0.5665661053933331
Be Ca La O,0.5665638095666667
Bi O Sc V,0.5665301729000001
B Ca Li O,0.5665226647833335
B Ba Mn O,0.5664275181499999
Cl In Nb O,0.5664147717733335
La Mo Pb Se,0.5663787347666666
Nb O Sr Ta,0.5663723990799996
Co Fe Np Si,0.5663415347333335
Ca H O Te,0.5662859553666665
Ba Eu Mn O,0.5662542800666667
Cs Nb O U,0.5661590899733339
Bi O Te V,0.5661453773666663
Cr Sc Sn V,0.5661164575533336
Ca H O U,0.5660590132133333
Co K O V,0.5660197990366665
Ga O Sc Sr,0.5660195426533334
K Li O Zr,0.5659587560666665
B Ce Mo O,0.5659316040733334
Ga O Sr Ta,0.565845856233333
B Be Ir Mg,0.5658037550333332
C Cr O S,0.5656440420333326
B Ca Cd O,0.565628117153333
Ba Nd O Sr,0.5655694601333333
Br Ca O Si,0.56546627742
Cs Mo O W,0.56542376858
C H O Ti,0.5654191874166671
F K V Zr,0.5653866751066668
Co Mg O Ti,0.5652577911533336
Cl Cs F Nb,0.5652031236100005
Bi Cl O V,0.5652029313333332
Ca H O Ta,0.5651317424000001
Ca F Mg Na,0.5650679602900003
O Sc Te V,0.5649555578533333
Cs Nb O Pr,0.5649404991066668
Br Cs Eu Nb,0.5649338460000002
Ba Mn O Sm,0.5648759103
B C La Ni,0.5647722093333334
Ba H O Si,0.5647219290099997
B C La Rh,0.5646988442666668
Ga O Pr Sr,0.5646830413
Bi Nb O Te,0.5646826406633331
Ba I Na O,0.5646658730833333
As K Mn O,0.5645988647166668
Al B K O,0.5644487227866668
C H P S,0.5644299797333335
Mn Nb Pb S,0.5643503425333332
C Cl F Te,0.5642788533166665
Ca Gd O Zr,0.5642562560533334
Ba Gd O Zr,0.5641747163333332
Mo O P Si,0.5641313889333331
Ba Bi Nd O,0.5641216717799998
Co Mo O Sr,0.5641059001999996
Br F Na Nb,0.5640872325066664
Cu O Ti Tm,0.56405235228
Ba H O Pt,0.5640409812999994
C Co O Si,0.5639645876666667
Al Ba O Pb,0.56388998152
Bi Ho O V,0.5638490175666667
Cd Mo O W,0.5638420509666668
Al C Cr Si,0.5638319995333334
Bi Ga O Ta,0.5637956661066664
Ba O Si Y,0.5636538302933336
Ag C Co O,0.5636306345933334
Al Er O Y,0.5635721813666666
Ba Er O Zn,0.5635634778733342
O Sr V Yb,0.5635626189800003
Bi Ca O Sr,0.5635363829933335
Al H Li O,0.5634890263333334
Er Fe Tb Ti,0.5633159654833333
Br C F Te,0.5632784712333332
Fe Gd Si Ti,0.5632103732
Mo Na O Sb,0.5631974516999999
K O Se Y,0.5631553396999998
B Br Ca O,0.5630947787866674
Ga O Sm Sr,0.5630609636999999
Cl Cs Lu Nb,0.56305837163
Eu Ge Li Mg,0.5629780952066668
Bi Mo O W,0.5629171955366671
C H S Sb,0.5628188533733332
Cl O Te V,0.5627583998399999
Ag Cs Mo Se,0.5626217930999998
Al B Cr Mo,0.5625759458166663
F Mo Na O,0.5625601586666663
As H K O,0.5625519009666665
Ba H O U,0.5625460520466667
In Nb O Sm,0.56252942196
Ag As Mg Na,0.5625274209333332
Ca O Si Y,0.5625122145333333
Ca Eu Mn O,0.5624948622866669
Cd O Pb V,0.5624722989833337
Mo S Sc Tl,0.562379509633333
K Nb O P,0.5623702595499999
Cs F Mo O,0.5623394313666663
Cr Mo Se Tl,0.5622701000333337
Li Mo O Sb,0.5622338384000001
Mo O Os Pb,0.5621439589166667
Ba O Tm Zr,0.5621428036666668
As Mo O Sb,0.5621324319333331
B Ca La O,0.5621262971833328
C F Ge H,0.5621172928266662
Cu O Ti Yb,0.5621103263
Al Au Eu V,0.5620764144333333
Br Cs Er Nb,0.5619052073666668
I K O Zr,0.5618939204333335
F Mn Nb O,0.5618906021699999
Cu Nb S Se,0.5618351903666664
Ba O S V,0.5617810758666661
Ca H O Pt,0.5617644970466668
F Li Mn V,0.5617077815666666
Ba O Ta Zr,0.561694372766667
Al Li Mn O,0.5616859856000002
Ba Mn O Pr,0.561526971866667
Ba Bi La O,0.5615049361666667
Ca Lu Mn O,0.5614403461333333
B K O Y,0.5613786664333337
Al O Sr Y,0.5613345805966669
Al As H O,0.5613275838000005
Ba Ho Mn O,0.5613078501000001
Ag O Te V,0.561280251206667
Bi Ce O V,0.5612731269466665
Ca Mn O Ta,0.5612101253166666
La Mo O Sb,0.561153091263333
Ba O Sn Sr,0.5611505093166659
Cr In V Zr,0.5611430357999998
Cl Mo O P,0.5611046794533336
H I O Y,0.5609583582666667
Br H O Y,0.5609256598566664
Er F Mo O,0.5608514541266676
Ba Mo O Ti,0.5608325150866668
Ca O Rb Ta,0.5608173708666664
Ag Mo O P,0.5607881799066667
Al As O Rb,0.5607300480666664
C F O Te,0.56058701767
Ge Mg Ni O,0.56055492326
Br H K O,0.5605502635666672
H O P V,0.5604987222666665
Ba Mn O Pt,0.5604525928333332
Co Ga Mn O,0.5604431295233335
Lu Nb O Sr,0.5603038246600001
C F O Sc,0.5602991405833332
Ba Dy Mn O,0.5601964471200003
Bi Co Mo O,0.56016880132
Ca Mn O Sm,0.5601279954833333
As H Hg O,0.5601129333666658
Ba Mn O Ta,0.5601055075999998
H I K O,0.5601007449666665
Nb O Pb Te,0.5600245752633332
C Cl O Sb,0.5600202858399999
Cu Ni O Sb,0.5599821310000004
Ca O Si Zr,0.559943858383333
Ca Ge O Y,0.5598199973166669
Ga Ge Na O,0.55980529882
Ba La O Sr,0.5597994202500002
O Se Th V,0.5597026708133328
K Nb O W,0.5596688693366664
C Ho O Sb,0.5596393956400001
Bi O Pb V,0.5596190272999999
Cl Nb O Te,0.559586819
Ca Ho Mn O,0.559459844
C La Mn Sb,0.5594563512033335
K Mn Nd O,0.5594437686333336
B C Lu Si,0.5594403186333332
Ba In Nd O,0.5594303034866668
C Cu S Ta,0.5594239327999998
Ga Nd O Si,0.5591767071133329
Cr Cu Se V,0.5591030390999997
B Co Ir Mg,0.559037659403333
Ca O Rb Si,0.5590355691999994
Ce Fe Gd Ho,0.5589404136000002
Nb O W Zr,0.5586994186400002
Br Cs Nb S,0.5586944926199997
C Na Ni O,0.5586293444966665
Cr Mn O Y,0.5586077565199997
Nb O Pr Sc,0.5585444766333333
K Li Mn O,0.5585017867633332
Nb O Sr Yb,0.5584992096000003
In K Mo Te,0.5584422008500001
Ga Gd O Sr,0.5583295606299998
H K Li O,0.5582694846466665
B O Pb V,0.5582688308533333
Al H Na O,0.5582405850666666
Ba H O Pb,0.5582385621000003
B Cr Nb Ru,0.5582012622866667
Ca O Sn Sr,0.5581749280433331
In Nb O Pb,0.5581575412166667
Nb O Sr Tm,0.5581530020833338
Ba Nb O S,0.5581477123000005
Na O P V,0.558030384653334
Ga Ge La O,0.5580066314566665
Ba Hg O Ru,0.5579984445999996
Ce Fe Ni Tb,0.5579818799999998
Ga O P Zr,0.5579622489966674
Al Ba O Si,0.5578884702
O P V Zn,0.5578825130299997
K Mn Na O,0.5578534005000004
Cr H O Y,0.5578471352666667
C H Ni O,0.5578196171300004
Dy Fe Pr Tb,0.5578026896699999
As Ca Cl O,0.5577983062333333
Ca Mn O Pr,0.5577831435966667
K La Mn O,0.557780362633333
Nb O Rb W,0.5577539092999999
C Mn S Ta,0.5577484914000002
Hf Nb O Sc,0.5577344425499999
Ba O Yb Zr,0.5577278096666668
Ce Ga O Sr,0.5576902138833331
F K Mo Na,0.5576002918866665
Ba Gd Mn O,0.5575821998000001
B C Sc U,0.5574856145
Ca Dy Mn O,0.5574830115533331
Ga La O Si,0.5574718107133331
As K O Sn,0.5574688764466671
Li Mg Pt Sb,0.5574554090766668
C Co Ge O,0.55737797698
Lu O Sc V,0.5573570711166669
Br Nb Rb S,0.5572986146999996
Bi Cl Nb O,0.5572479161433331
Nb Ni Sc Sn,0.5571732244966662
Li O P V,0.5571295353966664
Ga H O P,0.5571183050466668
Na O V W,0.5570963375799997
Ag Bi Nb O,0.5570960266500002
Nb O Sc Sm,0.55709002233
As O Rb Zr,0.5570827779000002
Mo O P U,0.5570738232200001
Cr H Hg O,0.5570150454666667
Mo O P Pb,0.5569386143766667
Ca Cl H O,0.5569228246666669
Al Ga O P,0.5568244106266665
Cr Sc Si V,0.5567589809333335
Br Cs F Nb,0.5567348220433336
Ga O Rb W,0.5567019060133335
Co Nb O Zr,0.5566991177866669
B C Er Ni,0.5566870994666668
Cr F Mg Rb,0.5566497902466662
As K O Rb,0.5566191289166663
Cl Nb Rb Ti,0.5566144390666671
C O P Pb,0.5565960041533332
Bi Nb O Ta,0.5565835678499996
Cl Ga Li Mn,0.5565551076666672
C Cl F Si,0.5565495317866669
Bi Nb O Pb,0.5565448213
Ba Ca F Mg,0.5564187819933336
Ba In La O,0.5564008788333334
Ga Li O P,0.5563743175933334
Ba K O P,0.556327330766667
Na Nb O P,0.5563198505766671
Ba In O Sn,0.5562952785133336
Mo Re S Zn,0.5562711182666669
C Co O Pb,0.5562422606799996
Ba O Os Y,0.5562375983
Ca Mn O Si,0.5562367095666664
O Sc Y Zr,0.5562240349200003
C O Si W,0.5562181897533334
Cl Eu Na V,0.5562114231466666
H O Se Y,0.5560997945533331
Ba Ce O Zr,0.5560951191966665
Al Cr H O,0.5560750277333333
Ga Ge Nd O,0.5560552605366664
Gd In Nb O,0.5560441784833334
Ga Ge O Zn,0.5560285354666668
Cr H K O,0.55593349768
Ga In O Pt,0.5558578048299999
Ca Nb O Ti,0.5558006957866667
Ge O Pb V,0.55576461792
F Mg O Ti,0.5557082633200003
H Li Mn O,0.5556781270666667
Ca Ge H O,0.5556133762000001
Br H Hg O,0.5554198869
Ba O Pr Sn,0.5553654683100002
O Rb Se Y,0.5553369107833336
O V W Zr,0.5553241452633337
Cs Ga Ge O,0.5553183651366671
B Ga O Pb,0.55530839808
Cl O Pb V,0.5552732198200002
F Na V Zr,0.5552717415433336
Ba Bi Na O,0.5552611059333333
Cr Mn Te V,0.5552375549166665
Cl Mo O Tb,0.5551564998433332
Mn O Sb V,0.5550512187799996
As H O Zr,0.5550383803666669
Ca Ge O Zr,0.5549729602133333
C H Pd Sb,0.5549521752
B C Er Rh,0.5549391567000002
Co F Li Mg,0.5549223265833332
Ce La Mo S,0.5548576367666663
Ba Ir O Y,0.5548570379999997
Cl Nb O Sc,0.5547993918099998
Ga Na O Si,0.5547619135100003
H S V Zr,0.5547472134799998
Eu Mo O W,0.5547234870433335
Al Ba Ge O,0.5546999923666667
Ba Mn O U,0.5546964579333337
H Mn O Sn,0.5546850527499997
Ag O U V,0.5546364484166669
Co H Mo Zr,0.5546096049433336
Ca Gd Mn O,0.5545318636166667
Ba Ge H O,0.554529757983333
H O Rb Sn,0.5545237250333335
B C Si Yb,0.5545072848999997
Ba Cl Mn O,0.5544916302333327
Au H Ir Nb,0.5544352929333333
B C Pt Th,0.5544293288999997
Mo O Pb W,0.5544266003500007
H Hg O Se,0.5543922627
Bi O V Yb,0.5542020965866666
Cl K O Y,0.5541875258666669
Ba Er O Sr,0.5540965037333333
Cu F Na V,0.554052949816667
Ag K Se V,0.5539793395199998
B C Eu Ni,0.5539663328333335
Ba Nd O Sc,0.5538441501666661
Cr K Mn O,0.5538402602333338
Nb O P Rb,0.5538280441399999
B Ba Nd O,0.5538074367866667
Nb O Pb Sc,0.5538058909500001
Ca O Pb Zr,0.5537925433466665
La Mo S Yb,0.5537829084666668
Ca H O Pb,0.5536280020999998
F K Mo Rb,0.5536255427933339
H Hg I O,0.5535113105666666
Al Br H O,0.5535077693999997
Cu S V Zr,0.5534766778833331
Ba Ca O Sb,0.5534431582333329
Ca Eu O Sn,0.5532791317033335
K O Te Y,0.5532065678266663
B K O Zr,0.5531860942
Cs F K Mo,0.5531709239066667
Al B O Y,0.5531482353899997
Al Ba O Ru,0.55304117608
H Nb O W,0.5530235719399997
